"","Org","Meeting","Name","Relevance","Year","Topic","Date"
"1","USFS","01-06-11_TRIG_FINAL_notes","Ann Risvold",0.311237,2011,"terrestrial",2011-01-06
"2","RMEF","01-06-11_TRIG_FINAL_notes","Bill Richardson",0.228615,2011,"terrestrial",2011-01-06
"3","RMEF","01-06-11_TRIG_FINAL_notes","Bob Nelson",0.19291,2011,"terrestrial",2011-01-06
"4","WDFW","01-06-11_TRIG_FINAL_notes","Brock Applegate",0.340791,2011,"terrestrial",2011-01-06
"5",NA,"01-06-11_TRIG_FINAL_notes","Bruce Stoker",0.15886,2011,"terrestrial",2011-01-06
"6","PSE","01-06-11_TRIG_FINAL_notes","Cary Feldmann",0.246373,2011,"terrestrial",2011-01-06
"7","NWIFC","01-06-11_TRIG_FINAL_notes","Chris Madsen",0.208597,2011,"terrestrial",2011-01-06
"8","Scott","01-06-11_TRIG_FINAL_notes","Haley Edwards",0.359896,2011,"terrestrial",2011-01-06
"9","PSE","01-06-11_TRIG_FINAL_notes","Ira McDaniel",0.224485,2011,"terrestrial",2011-01-06
"10","PDSA Consulting","01-06-11_TRIG_FINAL_notes","Jamie Riche",0.201287,2011,"terrestrial",2011-01-06
"11","USFWS","01-06-11_TRIG_FINAL_notes","Lou Ellyn Jones",0.201358,2011,"terrestrial",2011-01-06
"12","Biota-Pacific","01-06-11_TRIG_FINAL_notes","Marty Vaughn",0.37798,2011,"terrestrial",2011-01-06
"13","Haley","01-06-11_TRIG_FINAL_notes","Scott Heller",0.365591,2011,"terrestrial",2011-01-06
"14","Skagit River System Coop","01-06-11_TRIG_FINAL_notes","Stan Walsh",0.240027,2011,"terrestrial",2011-01-06
"15","PSE","01-06-11_TRIG_FINAL_notes","Tony Fuchs",0.307072,2011,"terrestrial",2011-01-06
"16","RMEF","02-02-12_TRIG_FINAL_notes","Bob Nelson",0.197503,2012,"terrestrial",2012-02-02
"17","WDFW","02-02-12_TRIG_FINAL_notes","Brock Applegate",0.510945,2012,"terrestrial",2012-02-02
"18",NA,"02-02-12_TRIG_FINAL_notes","Bruce Stoker",0.169389,2012,"terrestrial",2012-02-02
"19","PSE","02-02-12_TRIG_FINAL_notes","Cary Feldmann",0.245601,2012,"terrestrial",2012-02-02
"20","Scott","02-02-12_TRIG_FINAL_notes","Haley Edwards",0.205359,2012,"terrestrial",2012-02-02
"21","PSE","02-02-12_TRIG_FINAL_notes","Ira McDaniel",0.256895,2012,"terrestrial",2012-02-02
"22","PDSA Consulting","02-02-12_TRIG_FINAL_notes","Jamie Riche",0.20163,2012,"terrestrial",2012-02-02
"23","Smayda Environmental Associates","02-02-12_TRIG_FINAL_notes","Kathy Smayda",0.243714,2012,"terrestrial",2012-02-02
"24","PSE","02-02-12_TRIG_FINAL_notes","Lisa Salton",0.27318,2012,"terrestrial",2012-02-02
"25","NCCC","02-02-12_TRIG_FINAL_notes","Patrick Goldsworthy",0.200606,2012,"terrestrial",2012-02-02
"26","Haley","02-02-12_TRIG_FINAL_notes","Scott Heller",0.450198,2012,"terrestrial",2012-02-02
"27","Skagit River System Coop","02-02-12_TRIG_FINAL_notes","Stan Walsh",0.252974,2012,"terrestrial",2012-02-02
"28","PSE","02-02-12_TRIG_FINAL_notes","Tony Fuchs",0.864559,2012,"terrestrial",2012-02-02
"29","USFS","02-03-10botanicalteamlet finalnotes","Ann Risvold",0.816205,2010,"terrestrial",2010-02-03
"30","WDFW","02-03-10botanicalteamlet finalnotes","Brock Applegate",0.301798,2010,"terrestrial",2010-02-03
"31","PSE","02-03-10botanicalteamlet finalnotes","Jason Schmidt",0.32674,2010,"terrestrial",2010-02-03
"32","Smayda Environmental Associates","02-03-10botanicalteamlet finalnotes","Kathy Smayda",0.398798,2010,"terrestrial",2010-02-03
"33","USFS","02-03-10botanicalteamlet finalnotes","Laura Potash Martin",0.522162,2010,"terrestrial",2010-02-03
"34",NA,"02-03-10botanicalteamlet finalnotes","Lee Redmond",0.298616,2010,"terrestrial",2010-02-03
"35",NA,"02-03-10botanicalteamlet finalnotes","Sarah Prince",0.258323,2010,"terrestrial",2010-02-03
"36","Haley","02-03-10botanicalteamlet finalnotes","Scott Heller",0.904342,2010,"terrestrial",2010-02-03
"37","WSU","02-03-10botanicalteamlet finalnotes","Tim Miller",0.331702,2010,"terrestrial",2010-02-03
"38","PSE","02-03-10botanicalteamlet finalnotes","Tony Fuchs",0.35842,2010,"terrestrial",2010-02-03
"39","PSE","02-24-10 Alder Creek Teamlet Final notes revised","Andy Hunting",0.352283,2010,"terrestrial",2010-02-24
"40","WDFW","02-24-10 Alder Creek Teamlet Final notes revised","Brock Applegate",0.872922,2010,"terrestrial",2010-02-24
"41","Sauk-Suiattle Indian Tribe","02-24-10 Alder Creek Teamlet Final notes revised","Chris Danilson",0.474673,2010,"terrestrial",2010-02-24
"42","Huckell/Weinman Associates","02-24-10 Alder Creek Teamlet Final notes revised","Chris Lawson",0.4146,2010,"terrestrial",2010-02-24
"43","Scott","02-24-10 Alder Creek Teamlet Final notes revised","Haley Edwards",0.394923,2010,"terrestrial",2010-02-24
"44","PSE","02-24-10 Alder Creek Teamlet Final notes revised","Ira McDaniel",0.450334,2010,"terrestrial",2010-02-24
"45","R2 Resource Consultants","02-24-10 Alder Creek Teamlet Final notes revised","Joetta Zablotney",0.501431,2010,"terrestrial",2010-02-24
"46","Joetta","02-24-10 Alder Creek Teamlet Final notes revised","Mark Hitchcock",0.385459,2010,"terrestrial",2010-02-24
"47","Haley","02-24-10 Alder Creek Teamlet Final notes revised","Scott Heller",0.391169,2010,"terrestrial",2010-02-24
"48","PSE","02-24-10 Alder Creek Teamlet Final notes revised","Tony Fuchs",0.795355,2010,"terrestrial",2010-02-24
"49","USFS","03-03-11_TRIG_FINAL_notes","Ann Risvold",0.235696,2011,"terrestrial",2011-03-03
"50","NPS","03-03-11_TRIG_FINAL_notes","Bob Kuntz",0.260101,2011,"terrestrial",2011-03-03
"51","RMEF","03-03-11_TRIG_FINAL_notes","Bob Nelson",0.251587,2011,"terrestrial",2011-03-03
"52","WDFW","03-03-11_TRIG_FINAL_notes","Brock Applegate",0.241597,2011,"terrestrial",2011-03-03
"53",NA,"03-03-11_TRIG_FINAL_notes","Bruce Stoker",0.225713,2011,"terrestrial",2011-03-03
"54","PSE","03-03-11_TRIG_FINAL_notes","Cary Feldmann",0.25215,2011,"terrestrial",2011-03-03
"55","USFS","03-03-11_TRIG_FINAL_notes","Don Gay",0.342006,2011,"terrestrial",2011-03-03
"56","PSE","03-03-11_TRIG_FINAL_notes","Ed Schild",0.235087,2011,"terrestrial",2011-03-03
"57","Scott","03-03-11_TRIG_FINAL_notes","Haley Edwards",0.757424,2011,"terrestrial",2011-03-03
"58","PSE","03-03-11_TRIG_FINAL_notes","Ira McDaniel",0.49613,2011,"terrestrial",2011-03-03
"59","PDSA Consulting","03-03-11_TRIG_FINAL_notes","Jamie Riche",0.24265,2011,"terrestrial",2011-03-03
"60","NCCC","03-03-11_TRIG_FINAL_notes","Jim Davis",0.216843,2011,"terrestrial",2011-03-03
"61","Smayda Environmental Associates","03-03-11_TRIG_FINAL_notes","Kathy Smayda",0.245285,2011,"terrestrial",2011-03-03
"62","PSE","03-03-11_TRIG_FINAL_notes","Kim Lane",0.218512,2011,"terrestrial",2011-03-03
"63","USFWS","03-03-11_TRIG_FINAL_notes","Lou Ellyn Jones",0.252131,2011,"terrestrial",2011-03-03
"64","Biota-Pacific","03-03-11_TRIG_FINAL_notes","Marty Vaughn",0.388551,2011,"terrestrial",2011-03-03
"65","Haley","03-03-11_TRIG_FINAL_notes","Mel Walters",0.252483,2011,"terrestrial",2011-03-03
"66","NCCC","03-03-11_TRIG_FINAL_notes","Patrick Goldsworthy",0.231125,2011,"terrestrial",2011-03-03
"67","PSE","03-03-11_TRIG_FINAL_notes","Paul Wetherbee",0.213967,2011,"terrestrial",2011-03-03
"68","Haley","03-03-11_TRIG_FINAL_notes","Scott Heller",0.445391,2011,"terrestrial",2011-03-03
"69","PSE","03-03-11_TRIG_FINAL_notes","Tony Fuchs",0.347039,2011,"terrestrial",2011-03-03
"70","RMEF","03-07-13_TRIG_FINAL_notes","Bob Nelson",0.233303,2013,"terrestrial",2013-03-07
"71","WDFW","03-07-13_TRIG_FINAL_notes","Brock Applegate",0.274747,2013,"terrestrial",2013-03-07
"72","Sauk-Suiattle Indian Tribe","03-07-13_TRIG_FINAL_notes","Emily Wirtz",0.236765,2013,"terrestrial",2013-03-07
"73","Scott","03-07-13_TRIG_FINAL_notes","Haley Edwards",0.299161,2013,"terrestrial",2013-03-07
"74","PSE","03-07-13_TRIG_FINAL_notes","Ira McDaniel",0.355891,2013,"terrestrial",2013-03-07
"75","PSE","03-07-13_TRIG_FINAL_notes","Jacob Venard",0.223246,2013,"terrestrial",2013-03-07
"76","PDSA Consulting","03-07-13_TRIG_FINAL_notes","Jamie Riche",0.280606,2013,"terrestrial",2013-03-07
"77","USFWS","03-07-13_TRIG_FINAL_notes","Lou Ellyn Jones",0.23985,2013,"terrestrial",2013-03-07
"78","Swinomish","03-07-13_TRIG_FINAL_notes","Peter McBride",0.254487,2013,"terrestrial",2013-03-07
"79","RMEF","03-07-13_TRIG_FINAL_notes","Ray Croswell",0.248509,2013,"terrestrial",2013-03-07
"80","Haley","03-07-13_TRIG_FINAL_notes","Scott Heller",0.390408,2013,"terrestrial",2013-03-07
"81","USFS","03-07-13_TRIG_FINAL_notes","Shauna Hee",0.218247,2013,"terrestrial",2013-03-07
"82","Skagit River System Coop","03-07-13_TRIG_FINAL_notes","Stan Walsh",0.256922,2013,"terrestrial",2013-03-07
"83","USFS","03-07-13_TRIG_FINAL_notes","Theresa Mathis",0.269915,2013,"terrestrial",2013-03-07
"84","PSE","03-07-13_TRIG_FINAL_notes","Tony Fuchs",0.883144,2013,"terrestrial",2013-03-07
"85","WDFW","03-18-10 Alder Creek Teamlet Final notes","Brock Applegate",0.437002,2010,"terrestrial",2010-03-18
"86","NWIFC","03-18-10 Alder Creek Teamlet Final notes","Chris Madsen",0.433365,2010,"terrestrial",2010-03-18
"87","USFS","03-18-10 Alder Creek Teamlet Final notes","Don Gay",0.67994,2010,"terrestrial",2010-03-18
"88","Scott","03-18-10 Alder Creek Teamlet Final notes","Haley Edwards",0.382988,2010,"terrestrial",2010-03-18
"89","R2 Resource Consultants","03-18-10 Alder Creek Teamlet Final notes","Joetta Zablotney",0.785497,2010,"terrestrial",2010-03-18
"90","Smayda Environmental Associates","03-18-10 Alder Creek Teamlet Final notes","Kathy Smayda",0.445235,2010,"terrestrial",2010-03-18
"91","Biota-Pacific","03-18-10 Alder Creek Teamlet Final notes","Marty Vaughn",0.436182,2010,"terrestrial",2010-03-18
"92","Haley","03-18-10 Alder Creek Teamlet Final notes","Scott Heller",0.397108,2010,"terrestrial",2010-03-18
"93","PSE","03-18-10 Alder Creek Teamlet Final notes","Tony Fuchs",0.770268,2010,"terrestrial",2010-03-18
"94","PSE","04-05-12_TRIG_Final_notes.revised","Cary Feldmann",0.307409,2012,"terrestrial",2012-04-05
"95","USFWS","04-05-12_TRIG_Final_notes.revised","Deanna Lynch",0.185232,2012,"terrestrial",2012-04-05
"96","Scott","04-05-12_TRIG_Final_notes.revised","Haley Edwards",0.506738,2012,"terrestrial",2012-04-05
"97","PSE","04-05-12_TRIG_Final_notes.revised","Ira McDaniel",0.333785,2012,"terrestrial",2012-04-05
"98","PSE","04-05-12_TRIG_Final_notes.revised","Jacob Venard",0.210307,2012,"terrestrial",2012-04-05
"99","PDSA Consulting","04-05-12_TRIG_Final_notes.revised","Jamie Riche",0.243301,2012,"terrestrial",2012-04-05
"100","Smayda Environmental Associates","04-05-12_TRIG_Final_notes.revised","Kathy Smayda",0.285176,2012,"terrestrial",2012-04-05
"101","USFWS","04-05-12_TRIG_Final_notes.revised","Lou Ellyn Jones",0.174876,2012,"terrestrial",2012-04-05
"102","Biota-Pacific","04-05-12_TRIG_Final_notes.revised","Marty Vaughn",0.289989,2012,"terrestrial",2012-04-05
"103","Haley","04-05-12_TRIG_Final_notes.revised","Mel Walters",0.208786,2012,"terrestrial",2012-04-05
"104","Haley","04-05-12_TRIG_Final_notes.revised","Scott Heller",0.326953,2012,"terrestrial",2012-04-05
"105","Skagit River System Coop","04-05-12_TRIG_Final_notes.revised","Stan Walsh",0.302047,2012,"terrestrial",2012-04-05
"106","PSE","04-05-12_TRIG_Final_notes.revised","Tony Fuchs",0.311859,2012,"terrestrial",2012-04-05
"107",NA,"04-05-12_TRIG_Final_notes.revised","Tony Queue",0.303947,2012,"terrestrial",2012-04-05
"108","USFS","04-07-11_TRIG_FINAL_notes","Ann Risvold",0.230065,2011,"terrestrial",2011-04-07
"109","RMEF","04-07-11_TRIG_FINAL_notes","Bill Richardson",0.441058,2011,"terrestrial",2011-04-07
"110","RMEF","04-07-11_TRIG_FINAL_notes","Bob Nelson",0.22754,2011,"terrestrial",2011-04-07
"111","WDFW","04-07-11_TRIG_FINAL_notes","Brock Applegate",0.25563,2011,"terrestrial",2011-04-07
"112","PSE","04-07-11_TRIG_FINAL_notes","Cary Feldmann",0.2435,2011,"terrestrial",2011-04-07
"113","USFS","04-07-11_TRIG_FINAL_notes","Don Gay",0.27684,2011,"terrestrial",2011-04-07
"114","PSE","04-07-11_TRIG_FINAL_notes","Elizabeth Dubreuil",0.186727,2011,"terrestrial",2011-04-07
"115","Scott","04-07-11_TRIG_FINAL_notes","Haley Edwards",0.518204,2011,"terrestrial",2011-04-07
"116","PSE","04-07-11_TRIG_FINAL_notes","Ira McDaniel",0.495253,2011,"terrestrial",2011-04-07
"117","PDSA Consulting","04-07-11_TRIG_FINAL_notes","Jamie Riche",0.242655,2011,"terrestrial",2011-04-07
"118","Smayda Environmental Associates","04-07-11_TRIG_FINAL_notes","Kathy Smayda",0.331672,2011,"terrestrial",2011-04-07
"119","USFWS","04-07-11_TRIG_FINAL_notes","Lou Ellyn Jones",0.242766,2011,"terrestrial",2011-04-07
"120","Biota-Pacific","04-07-11_TRIG_FINAL_notes","Marty Vaughn",0.399484,2011,"terrestrial",2011-04-07
"121","NCCC","04-07-11_TRIG_FINAL_notes","Patrick Goldsworthy",0.24144,2011,"terrestrial",2011-04-07
"122","Haley","04-07-11_TRIG_FINAL_notes","Scott Heller",0.422302,2011,"terrestrial",2011-04-07
"123","PSE","04-07-11_TRIG_FINAL_notes","Tony Fuchs",0.89467,2011,"terrestrial",2011-04-07
"124",NA,"04-07-11_TRIG_FINAL_notes","Will Wharton",0.224591,2011,"terrestrial",2011-04-07
"125","Scott","04-11-13_botanicalteamlet_finalnotes","Haley Edwards",0.243677,2013,"terrestrial",2013-04-11
"126","16 sites in 2003","04-11-13_botanicalteamlet_finalnotes","Herb Robert",0.225662,2013,"terrestrial",2013-04-11
"127","R2 Resource Consultants","04-11-13_botanicalteamlet_finalnotes","Joetta Zablotney",0.187396,2013,"terrestrial",2013-04-11
"128","Smayda Environmental Associates","04-11-13_botanicalteamlet_finalnotes","Kathy Smayda",0.249179,2013,"terrestrial",2013-04-11
"129","Haley","04-11-13_botanicalteamlet_finalnotes","Scott Heller",0.875711,2013,"terrestrial",2013-04-11
"130","USFS","04-11-13_botanicalteamlet_finalnotes","Shauna Hee",0.891751,2013,"terrestrial",2013-04-11
"131","PSE","04-11-13_botanicalteamlet_finalnotes","Tony Fuchs",0.24266,2013,"terrestrial",2013-04-11
"132","USFS","05-05-11_TRIG_FINAL_notes","Ann Risvold",0.235795,2011,"terrestrial",2011-05-05
"133","RMEF","05-05-11_TRIG_FINAL_notes","Bill Richardson",0.4403,2011,"terrestrial",2011-05-05
"134","RMEF","05-05-11_TRIG_FINAL_notes","Bob Nelson",0.228549,2011,"terrestrial",2011-05-05
"135","WDFW","05-05-11_TRIG_FINAL_notes","Brock Applegate",0.383606,2011,"terrestrial",2011-05-05
"136",NA,"05-05-11_TRIG_FINAL_notes","Bruce Stoker",0.228704,2011,"terrestrial",2011-05-05
"137","PSE","05-05-11_TRIG_FINAL_notes","Cary Feldmann",0.333437,2011,"terrestrial",2011-05-05
"138",NA,"05-05-11_TRIG_FINAL_notes","Dave Carlson",0.171922,2011,"terrestrial",2011-05-05
"139","USFS","05-05-11_TRIG_FINAL_notes","Don Gay",0.318103,2011,"terrestrial",2011-05-05
"140","Scott","05-05-11_TRIG_FINAL_notes","Haley Edwards",0.52314,2011,"terrestrial",2011-05-05
"141","PSE","05-05-11_TRIG_FINAL_notes","Ira McDaniel",0.281333,2011,"terrestrial",2011-05-05
"142","PDSA Consulting","05-05-11_TRIG_FINAL_notes","Jamie Riche",0.2521,2011,"terrestrial",2011-05-05
"143","Smayda Environmental Associates","05-05-11_TRIG_FINAL_notes","Kathy Smayda",0.291213,2011,"terrestrial",2011-05-05
"144",NA,"05-05-11_TRIG_FINAL_notes","Kevin Killian",0.203367,2011,"terrestrial",2011-05-05
"145","PSE","05-05-11_TRIG_FINAL_notes","Kim Lane",0.253699,2011,"terrestrial",2011-05-05
"146","USFWS","05-05-11_TRIG_FINAL_notes","Lou Ellyn Jones",0.240621,2011,"terrestrial",2011-05-05
"147","Biota-Pacific","05-05-11_TRIG_FINAL_notes","Marty Vaughn",0.295626,2011,"terrestrial",2011-05-05
"148","Haley","05-05-11_TRIG_FINAL_notes","Scott Heller",0.226384,2011,"terrestrial",2011-05-05
"149","PSE","05-05-11_TRIG_FINAL_notes","Scott Williams",0.22514,2011,"terrestrial",2011-05-05
"150","WDNR","05-05-11_TRIG_FINAL_notes","Steve Jennison",0.193625,2011,"terrestrial",2011-05-05
"151","PSE","05-05-11_TRIG_FINAL_notes","Tony Fuchs",0.322405,2011,"terrestrial",2011-05-05
"152","RMEF","06-06-13_TRIG_FINAL_notes","Bob Nelson",0.235773,2013,"terrestrial",2013-06-06
"153","WDFW","06-06-13_TRIG_FINAL_notes","Brock Applegate",0.497576,2013,"terrestrial",2013-06-06
"154","Scott","06-06-13_TRIG_FINAL_notes","Haley Edwards",0.500862,2013,"terrestrial",2013-06-06
"155","PSE","06-06-13_TRIG_FINAL_notes","Ira McDaniel",0.34728,2013,"terrestrial",2013-06-06
"156","PDSA Consulting","06-06-13_TRIG_FINAL_notes","Jamie Riche",0.277018,2013,"terrestrial",2013-06-06
"157","USFWS","06-06-13_TRIG_FINAL_notes","Lou Ellyn Jones",0.192359,2013,"terrestrial",2013-06-06
"158","Haley","06-06-13_TRIG_FINAL_notes","Mel Walters",0.316592,2013,"terrestrial",2013-06-06
"159","Swinomish","06-06-13_TRIG_FINAL_notes","Peter McBride",0.487584,2013,"terrestrial",2013-06-06
"160","Haley","06-06-13_TRIG_FINAL_notes","Scott Heller",0.450475,2013,"terrestrial",2013-06-06
"161",NA,"06-06-13_TRIG_FINAL_notes","Sean O’Connell",0.258847,2013,"terrestrial",2013-06-06
"162","USFS","06-06-13_TRIG_FINAL_notes","Shauna Hee",0.234049,2013,"terrestrial",2013-06-06
"163","Skagit River System Coop","06-06-13_TRIG_FINAL_notes","Stan Walsh",0.397367,2013,"terrestrial",2013-06-06
"164","USFS","06-06-13_TRIG_FINAL_notes","Theresa Mathis",0.411922,2013,"terrestrial",2013-06-06
"165","PSE","06-06-13_TRIG_FINAL_notes","Tom Flynn",0.239459,2013,"terrestrial",2013-06-06
"166","PSE","06-06-13_TRIG_FINAL_notes","Tony Fuchs",0.33453,2013,"terrestrial",2013-06-06
"167",NA,"06-07-12_TRIG_FINAL_notes","Bob K. Cary",0.235992,2012,"terrestrial",2012-06-07
"168","RMEF","06-07-12_TRIG_FINAL_notes","Bob Nelson",0.240354,2012,"terrestrial",2012-06-07
"169","WDFW","06-07-12_TRIG_FINAL_notes","Brock Applegate",0.43035,2012,"terrestrial",2012-06-07
"170","PSE","06-07-12_TRIG_FINAL_notes","Cary Feldmann",0.246987,2012,"terrestrial",2012-06-07
"171","Scott","06-07-12_TRIG_FINAL_notes","Haley Edwards",0.664982,2012,"terrestrial",2012-06-07
"172","PSE","06-07-12_TRIG_FINAL_notes","Ira McDaniel",0.250025,2012,"terrestrial",2012-06-07
"173","PDSA Consulting","06-07-12_TRIG_FINAL_notes","Jamie Riche",0.285598,2012,"terrestrial",2012-06-07
"174","Smayda Environmental Associates","06-07-12_TRIG_FINAL_notes","Kathy Smayda",0.405543,2012,"terrestrial",2012-06-07
"175","USFWS","06-07-12_TRIG_FINAL_notes","Lou Ellyn Jones",0.254215,2012,"terrestrial",2012-06-07
"176","Haley","06-07-12_TRIG_FINAL_notes","Scott Heller",0.295473,2012,"terrestrial",2012-06-07
"177","PSE","06-07-12_TRIG_FINAL_notes","Tony Fuchs",0.730366,2012,"terrestrial",2012-06-07
"178","NPS","07-25-11 Burpee Hill Teamlet Final notes","Bob Kuntz",0.294307,2011,"terrestrial",2011-07-25
"179","WDFW","07-25-11 Burpee Hill Teamlet Final notes","Brock Applegate",0.321434,2011,"terrestrial",2011-07-25
"180","Sauk-Suiattle Indian Tribe","07-25-11 Burpee Hill Teamlet Final notes","Chris Danilson",0.325041,2011,"terrestrial",2011-07-25
"181","USFS","07-25-11 Burpee Hill Teamlet Final notes","Don Gay",0.480084,2011,"terrestrial",2011-07-25
"182","Scott","07-25-11 Burpee Hill Teamlet Final notes","Haley Edwards",0.281022,2011,"terrestrial",2011-07-25
"183","Smayda Environmental Associates","07-25-11 Burpee Hill Teamlet Final notes","Kathy Smayda",0.333806,2011,"terrestrial",2011-07-25
"184","USFWS","07-25-11 Burpee Hill Teamlet Final notes","Lindsy Wright",0.324043,2011,"terrestrial",2011-07-25
"185","Biota-Pacific","07-25-11 Burpee Hill Teamlet Final notes","Marty Vaughn",0.399776,2011,"terrestrial",2011-07-25
"186","Haley","07-25-11 Burpee Hill Teamlet Final notes","Scott Heller",0.291875,2011,"terrestrial",2011-07-25
"187","PSE","07-25-11 Burpee Hill Teamlet Final notes","Tony Fuchs",0.79798,2011,"terrestrial",2011-07-25
"188","RMEF","08-04-11_TRIG_FINAL_notes","Bill Richardson",0.210127,2011,"terrestrial",2011-08-04
"189","RMEF","08-04-11_TRIG_FINAL_notes","Bob Nelson",0.16011,2011,"terrestrial",2011-08-04
"190","WDFW","08-04-11_TRIG_FINAL_notes","Brock Applegate",0.216142,2011,"terrestrial",2011-08-04
"191",NA,"08-04-11_TRIG_FINAL_notes","Bruce Stoker",0.1279,2011,"terrestrial",2011-08-04
"192","PSE","08-04-11_TRIG_FINAL_notes","Cary Feldmann",0.17018,2011,"terrestrial",2011-08-04
"193","Sauk-Suiattle Indian Tribe","08-04-11_TRIG_FINAL_notes","Chris Danilson",0.130974,2011,"terrestrial",2011-08-04
"194","Scott","08-04-11_TRIG_FINAL_notes","Haley Edwards",0.27908,2011,"terrestrial",2011-08-04
"195","PSE","08-04-11_TRIG_FINAL_notes","Ira McDaniel",0.157894,2011,"terrestrial",2011-08-04
"196","PDSA Consulting","08-04-11_TRIG_FINAL_notes","Jamie Riche",0.147061,2011,"terrestrial",2011-08-04
"197","Smayda Environmental Associates","08-04-11_TRIG_FINAL_notes","Kathy Smayda",0.160556,2011,"terrestrial",2011-08-04
"198","USFWS","08-04-11_TRIG_FINAL_notes","Lou Ellyn Jones",0.146967,2011,"terrestrial",2011-08-04
"199","Biota-Pacific","08-04-11_TRIG_FINAL_notes","Marty Vaughn",0.197284,2011,"terrestrial",2011-08-04
"200","Haley","08-04-11_TRIG_FINAL_notes","Mel Walters",0.16672,2011,"terrestrial",2011-08-04
"201","NCCC","08-04-11_TRIG_FINAL_notes","Patrick Goldsworthy",0.14662,2011,"terrestrial",2011-08-04
"202","Haley","08-04-11_TRIG_FINAL_notes","Scott Heller",0.134788,2011,"terrestrial",2011-08-04
"203","PSE","08-04-11_TRIG_FINAL_notes","Scott Williams",0.135314,2011,"terrestrial",2011-08-04
"204","Skagit River System Coop","08-04-11_TRIG_FINAL_notes","Stan Walsh",0.227394,2011,"terrestrial",2011-08-04
"205","PSE","08-04-11_TRIG_FINAL_notes","Tony Fuchs",0.476594,2011,"terrestrial",2011-08-04
"206","USFS","08-05-10_TRIG_FINAL_notes","Ann Risvold",0.316727,2010,"terrestrial",2010-08-05
"207","NPS","08-05-10_TRIG_FINAL_notes","Bob Kuntz",0.326408,2010,"terrestrial",2010-08-05
"208","RMEF","08-05-10_TRIG_FINAL_notes","Bob Nelson",0.321962,2010,"terrestrial",2010-08-05
"209","WDFW","08-05-10_TRIG_FINAL_notes","Brock Applegate",0.601643,2010,"terrestrial",2010-08-05
"210","USFS","08-05-10_TRIG_FINAL_notes","Don Gay",0.394218,2010,"terrestrial",2010-08-05
"211","Scott","08-05-10_TRIG_FINAL_notes","Haley Edwards",0.73885,2010,"terrestrial",2010-08-05
"212","PSE","08-05-10_TRIG_FINAL_notes","Ira McDaniel",0.454238,2010,"terrestrial",2010-08-05
"213","PDSA Consulting","08-05-10_TRIG_FINAL_notes","Jamie Riche",0.320771,2010,"terrestrial",2010-08-05
"214","Smayda Environmental Associates","08-05-10_TRIG_FINAL_notes","Kathy Smayda",0.335906,2010,"terrestrial",2010-08-05
"215","PSE","08-05-10_TRIG_FINAL_notes","Kim Lane",0.526685,2010,"terrestrial",2010-08-05
"216","USFWS","08-05-10_TRIG_FINAL_notes","Lou Ellyn Jones",0.330125,2010,"terrestrial",2010-08-05
"217","Joetta","08-05-10_TRIG_FINAL_notes","Mark Hitchcock",0.392502,2010,"terrestrial",2010-08-05
"218","360","08-05-10_TRIG_FINAL_notes","Martha Bray",0.342676,2010,"terrestrial",2010-08-05
"219","Biota-Pacific","08-05-10_TRIG_FINAL_notes","Marty Vaughn",0.369343,2010,"terrestrial",2010-08-05
"220","Haley","08-05-10_TRIG_FINAL_notes","Mel Walters",0.50619,2010,"terrestrial",2010-08-05
"221","NCCC","08-05-10_TRIG_FINAL_notes","Patrick Goldsworthy",0.318896,2010,"terrestrial",2010-08-05
"222","Haley","08-05-10_TRIG_FINAL_notes","Scott Heller",0.488058,2010,"terrestrial",2010-08-05
"223","Skagit River System Coop","08-05-10_TRIG_FINAL_notes","Stan Walsh",0.401665,2010,"terrestrial",2010-08-05
"224","PSE","08-05-10_TRIG_FINAL_notes","Tony Fuchs",0.399801,2010,"terrestrial",2010-08-05
"225","USFS","09-02-10_TRIG_FINAL_notes","Ann Risvold",0.253821,2010,"terrestrial",2010-09-02
"226","WDFW","09-02-10_TRIG_FINAL_notes","Brock Applegate",0.372396,2010,"terrestrial",2010-09-02
"227","PSE","09-02-10_TRIG_FINAL_notes","Cary Feldmann",0.484442,2010,"terrestrial",2010-09-02
"228","USFS","09-02-10_TRIG_FINAL_notes","Don Gay",0.39614,2010,"terrestrial",2010-09-02
"229","Scott","09-02-10_TRIG_FINAL_notes","Haley Edwards",0.498178,2010,"terrestrial",2010-09-02
"230","PSE","09-02-10_TRIG_FINAL_notes","Ira McDaniel",0.442213,2010,"terrestrial",2010-09-02
"231","PDSA Consulting","09-02-10_TRIG_FINAL_notes","Jamie Riche",0.324349,2010,"terrestrial",2010-09-02
"232","Smayda Environmental Associates","09-02-10_TRIG_FINAL_notes","Kathy Smayda",0.477993,2010,"terrestrial",2010-09-02
"233","USFWS","09-02-10_TRIG_FINAL_notes","Lou Ellyn Jones",0.325229,2010,"terrestrial",2010-09-02
"234","Biota-Pacific","09-02-10_TRIG_FINAL_notes","Marty Vaughn",0.741591,2010,"terrestrial",2010-09-02
"235","Haley","09-02-10_TRIG_FINAL_notes","Mel Walters",0.457927,2010,"terrestrial",2010-09-02
"236","Haley","09-02-10_TRIG_FINAL_notes","Scott Heller",0.547182,2010,"terrestrial",2010-09-02
"237","Skagit River System Coop","09-02-10_TRIG_FINAL_notes","Stan Walsh",0.326628,2010,"terrestrial",2010-09-02
"238","WSU","09-02-10_TRIG_FINAL_notes","Tim Miller",0.237835,2010,"terrestrial",2010-09-02
"239","PSE","09-02-10_TRIG_FINAL_notes","Tony Fuchs",0.436296,2010,"terrestrial",2010-09-02
"240","RMEF","09-05-13_TRIG_FINAL_notes","Bob Nelson",0.29364,2013,"terrestrial",2013-09-05
"241","WDFW","09-05-13_TRIG_FINAL_notes","Brock Applegate",0.278407,2013,"terrestrial",2013-09-05
"242","Sauk-Suiattle Indian Tribe","09-05-13_TRIG_FINAL_notes","Chris Danilson",0.171904,2013,"terrestrial",2013-09-05
"243","Sauk-Suiattle Indian Tribe","09-05-13_TRIG_FINAL_notes","Emily Wirtz",0.334172,2013,"terrestrial",2013-09-05
"244","Scott","09-05-13_TRIG_FINAL_notes","Haley Edwards",0.819818,2013,"terrestrial",2013-09-05
"245","PSE","09-05-13_TRIG_FINAL_notes","Ira McDaniel",0.300285,2013,"terrestrial",2013-09-05
"246","PDSA Consulting","09-05-13_TRIG_FINAL_notes","Jamie Riche",0.290074,2013,"terrestrial",2013-09-05
"247","USFWS","09-05-13_TRIG_FINAL_notes","Lou Ellyn Jones",0.245299,2013,"terrestrial",2013-09-05
"248","Haley","09-05-13_TRIG_FINAL_notes","Mel Walters",0.268881,2013,"terrestrial",2013-09-05
"249","Haley","09-05-13_TRIG_FINAL_notes","Scott Heller",0.647726,2013,"terrestrial",2013-09-05
"250","Skagit River System Coop","09-05-13_TRIG_FINAL_notes","Stan Walsh",0.246155,2013,"terrestrial",2013-09-05
"251","USFS","09-05-13_TRIG_FINAL_notes","Theresa Mathis",0.404104,2013,"terrestrial",2013-09-05
"252","PSE","09-05-13_TRIG_FINAL_notes","Tom Flynn",0.360748,2013,"terrestrial",2013-09-05
"253","RMEF","09-06-12_TRIG_FINAL_notes","Bob Nelson",0.240781,2012,"terrestrial",2012-09-06
"254","WDFW","09-06-12_TRIG_FINAL_notes","Brock Applegate",0.537424,2012,"terrestrial",2012-09-06
"255","Scott","09-06-12_TRIG_FINAL_notes","Haley Edwards",0.557632,2012,"terrestrial",2012-09-06
"256","PSE","09-06-12_TRIG_FINAL_notes","Ira McDaniel",0.285028,2012,"terrestrial",2012-09-06
"257","PSE","09-06-12_TRIG_FINAL_notes","Jacob Venard",0.312862,2012,"terrestrial",2012-09-06
"258","PDSA Consulting","09-06-12_TRIG_FINAL_notes","Jamie Riche",0.280019,2012,"terrestrial",2012-09-06
"259","Smayda Environmental Associates","09-06-12_TRIG_FINAL_notes","Kathy Smayda",0.282262,2012,"terrestrial",2012-09-06
"260","USFWS","09-06-12_TRIG_FINAL_notes","Lou Ellyn Jones",0.233935,2012,"terrestrial",2012-09-06
"261","Haley","09-06-12_TRIG_FINAL_notes","Mel Walters",0.265375,2012,"terrestrial",2012-09-06
"262","Haley","09-06-12_TRIG_FINAL_notes","Scott Heller",0.433404,2012,"terrestrial",2012-09-06
"263","Skagit River System Coop","09-06-12_TRIG_FINAL_notes","Stan Walsh",0.26124,2012,"terrestrial",2012-09-06
"264","PSE","09-06-12_TRIG_FINAL_notes","Tom Flynn",0.22152,2012,"terrestrial",2012-09-06
"265","PSE","09-06-12_TRIG_FINAL_notes","Tony Fuchs",0.85578,2012,"terrestrial",2012-09-06
"266","USFS","100216_RRG-FinalNotes","Ann Dunphy",0.509419,2010,"recreational",2010-02-16
"267","WDFW","100216_RRG-FinalNotes","Brock Applegate",0.246818,2010,"recreational",2010-02-16
"268","USFS","100216_RRG-FinalNotes","Carol Gladsjo",0.225585,2010,"recreational",2010-02-16
"269","PSE","100216_RRG-FinalNotes","Cary Feldmann",0.387622,2010,"recreational",2010-02-16
"270","Whatcom County","100216_RRG-FinalNotes","Jeff Turner",0.286578,2010,"recreational",2010-02-16
"271","USFS","100216_RRG-FinalNotes","Jon Vanderheyden",0.354883,2010,"recreational",2010-02-16
"272","PDSA Consulting","100216_RRG-FinalNotes","Lyn Wiltse",0.329117,2010,"recreational",2010-02-16
"273","PSE","100216_RRG-FinalNotes","Pam Garland",0.677584,2010,"recreational",2010-02-16
"274","AECOM","100216_RRG-FinalNotes","Sergio Capozzi",0.492371,2010,"recreational",2010-02-16
"275","USFS","10-06-11_TRIG_FINAL_notes","Ann Risvold",0.221334,2011,"terrestrial",2011-10-06
"276","RMEF","10-06-11_TRIG_FINAL_notes","Bill Richardson",0.273985,2011,"terrestrial",2011-10-06
"277","RMEF","10-06-11_TRIG_FINAL_notes","Bob Nelson",0.27681,2011,"terrestrial",2011-10-06
"278","WDFW","10-06-11_TRIG_FINAL_notes","Brock Applegate",0.390649,2011,"terrestrial",2011-10-06
"279","PSE","10-06-11_TRIG_FINAL_notes","Cary Feldmann",0.307172,2011,"terrestrial",2011-10-06
"280","USFS","10-06-11_TRIG_FINAL_notes","Don Gay",0.259373,2011,"terrestrial",2011-10-06
"281","USFS","10-06-11_TRIG_FINAL_notes","Greta Movassaghi",0.249824,2011,"terrestrial",2011-10-06
"282","Scott","10-06-11_TRIG_FINAL_notes","Haley Edwards",0.466276,2011,"terrestrial",2011-10-06
"283","PSE","10-06-11_TRIG_FINAL_notes","Ira McDaniel",0.351052,2011,"terrestrial",2011-10-06
"284","PDSA Consulting","10-06-11_TRIG_FINAL_notes","Jamie Riche",0.237431,2011,"terrestrial",2011-10-06
"285","Smayda Environmental Associates","10-06-11_TRIG_FINAL_notes","Kathy Smayda",0.259997,2011,"terrestrial",2011-10-06
"286","Biota-Pacific","10-06-11_TRIG_FINAL_notes","Marty Vaughn",0.423129,2011,"terrestrial",2011-10-06
"287","Haley","10-06-11_TRIG_FINAL_notes","Mel Walters",0.325737,2011,"terrestrial",2011-10-06
"288","WDFW","10-06-11_TRIG_FINAL_notes","Mike Davison",0.273562,2011,"terrestrial",2011-10-06
"289","NCCC","10-06-11_TRIG_FINAL_notes","Patrick Goldsworthy",0.236575,2011,"terrestrial",2011-10-06
"290","Haley","10-06-11_TRIG_FINAL_notes","Scott Heller",0.450299,2011,"terrestrial",2011-10-06
"291","Skagit River System Coop","10-06-11_TRIG_FINAL_notes","Stan Walsh",0.283127,2011,"terrestrial",2011-10-06
"292","PSE","10-06-11_TRIG_FINAL_notes","Tony Fuchs",0.816799,2011,"terrestrial",2011-10-06
"293",NA,"10-06-11_TRIG_FINAL_notes","Will Wharton",0.229864,2011,"terrestrial",2011-10-06
"294","RMEF","10-07-10_TRIG_FINAL_notes","Bob Nelson",0.252413,2010,"terrestrial",2010-10-07
"295","WDFW","10-07-10_TRIG_FINAL_notes","Brock Applegate",0.491588,2010,"terrestrial",2010-10-07
"296","PSE","10-07-10_TRIG_FINAL_notes","Cary Feldmann",0.250732,2010,"terrestrial",2010-10-07
"297","USFS","10-07-10_TRIG_FINAL_notes","Don Gay",0.256571,2010,"terrestrial",2010-10-07
"298","Scott","10-07-10_TRIG_FINAL_notes","Haley Edwards",0.557803,2010,"terrestrial",2010-10-07
"299","16 sites in 2003","10-07-10_TRIG_FINAL_notes","Herb Robert",0.214397,2010,"terrestrial",2010-10-07
"300","PSE","10-07-10_TRIG_FINAL_notes","Ira McDaniel",0.285488,2010,"terrestrial",2010-10-07
"301","PDSA Consulting","10-07-10_TRIG_FINAL_notes","Jamie Riche",0.244501,2010,"terrestrial",2010-10-07
"302","Smayda Environmental Associates","10-07-10_TRIG_FINAL_notes","Kathy Smayda",0.345905,2010,"terrestrial",2010-10-07
"303","USFWS","10-07-10_TRIG_FINAL_notes","Lou Ellyn Jones",0.244743,2010,"terrestrial",2010-10-07
"304","Biota-Pacific","10-07-10_TRIG_FINAL_notes","Marty Vaughn",0.368591,2010,"terrestrial",2010-10-07
"305","Haley","10-07-10_TRIG_FINAL_notes","Mel Walters",0.358691,2010,"terrestrial",2010-10-07
"306","PSE","10-07-10_TRIG_FINAL_notes","Pam Garland",0.194899,2010,"terrestrial",2010-10-07
"307","NCCC","10-07-10_TRIG_FINAL_notes","Patrick Goldsworthy",0.255635,2010,"terrestrial",2010-10-07
"308","Haley","10-07-10_TRIG_FINAL_notes","Scott Heller",0.38247,2010,"terrestrial",2010-10-07
"309","Skagit River System Coop","10-07-10_TRIG_FINAL_notes","Stan Walsh",0.307297,2010,"terrestrial",2010-10-07
"310","PSE","10-07-10_TRIG_FINAL_notes","Tony Fuchs",0.363499,2010,"terrestrial",2010-10-07
"311","USFS","1-07-10_TRIG_FINAL_notes","Ann Risvold",0.281285,2010,"terrestrial",2010-01-07
"312","RMEF","1-07-10_TRIG_FINAL_notes","Bill Richardson",0.36283,2010,"terrestrial",2010-01-07
"313","RMEF","1-07-10_TRIG_FINAL_notes","Bob Nelson",0.335455,2010,"terrestrial",2010-01-07
"314","WDFW","1-07-10_TRIG_FINAL_notes","Brock Applegate",0.601322,2010,"terrestrial",2010-01-07
"315","PSE","1-07-10_TRIG_FINAL_notes","Cary Feldmann",0.430702,2010,"terrestrial",2010-01-07
"316","Sauk-Suiattle Indian Tribe","1-07-10_TRIG_FINAL_notes","Chris Danilson",0.332435,2010,"terrestrial",2010-01-07
"317","Frank","1-07-10_TRIG_FINAL_notes","Christina VerHeul",0.284487,2010,"terrestrial",2010-01-07
"318","USFS","1-07-10_TRIG_FINAL_notes","Don Gay",0.417381,2010,"terrestrial",2010-01-07
"319","Scott","1-07-10_TRIG_FINAL_notes","Haley Edwards",0.486271,2010,"terrestrial",2010-01-07
"320","PSE","1-07-10_TRIG_FINAL_notes","Ira McDaniel",0.370046,2010,"terrestrial",2010-01-07
"321","PSE","1-07-10_TRIG_FINAL_notes","Jacob Venard",0.355953,2010,"terrestrial",2010-01-07
"322","Smayda Environmental Associates","1-07-10_TRIG_FINAL_notes","Kathy Smayda",0.513574,2010,"terrestrial",2010-01-07
"323","PDSA Consulting","1-07-10_TRIG_FINAL_notes","Lyn Wiltse",0.309513,2010,"terrestrial",2010-01-07
"324","Biota-Pacific","1-07-10_TRIG_FINAL_notes","Marty Vaughn",0.557083,2010,"terrestrial",2010-01-07
"325","PSE","1-07-10_TRIG_FINAL_notes","Pam Garland",0.281857,2010,"terrestrial",2010-01-07
"326","Haley","1-07-10_TRIG_FINAL_notes","Scott Heller",0.58573,2010,"terrestrial",2010-01-07
"327","Skagit River System Coop","1-07-10_TRIG_FINAL_notes","Stan Walsh",0.3064,2010,"terrestrial",2010-01-07
"328","PSE","1-07-10_TRIG_FINAL_notes","Tony Fuchs",0.418296,2010,"terrestrial",2010-01-07
"329","PSE","11-02-10 botanicalteamlet finalnotes","Andy Hunting",0.33953,2010,"terrestrial",2010-11-02
"330","USFS","11-02-10 botanicalteamlet finalnotes","Ann Risvold",0.763313,2010,"terrestrial",2010-11-02
"331","Scott","11-02-10 botanicalteamlet finalnotes","Haley Edwards",0.279258,2010,"terrestrial",2010-11-02
"332","16 sites in 2003","11-02-10 botanicalteamlet finalnotes","Herb Robert",0.269639,2010,"terrestrial",2010-11-02
"333","PSE","11-02-10 botanicalteamlet finalnotes","Jason Schmidt",0.300486,2010,"terrestrial",2010-11-02
"334","R2 Resource Consultants","11-02-10 botanicalteamlet finalnotes","Joetta Zablotney",0.335411,2010,"terrestrial",2010-11-02
"335","Smayda Environmental Associates","11-02-10 botanicalteamlet finalnotes","Kathy Smayda",0.444264,2010,"terrestrial",2010-11-02
"336","PSE","11-02-10 botanicalteamlet finalnotes","Kim Lane",0.266655,2010,"terrestrial",2010-11-02
"337",NA,"11-02-10 botanicalteamlet finalnotes","Sarah Prince",0.261001,2010,"terrestrial",2010-11-02
"338","Haley","11-02-10 botanicalteamlet finalnotes","Scott Heller",0.774118,2010,"terrestrial",2010-11-02
"339","WSU","11-02-10 botanicalteamlet finalnotes","Tim Miller",0.327742,2010,"terrestrial",2010-11-02
"340","PSE","11-02-10 botanicalteamlet finalnotes","Tony Fuchs",0.416037,2010,"terrestrial",2010-11-02
"341","RMEF","11-8-12_TRIG_Conference Call_FINAL_notes","Bill Richardson",0.331966,2012,"terrestrial",2012-11-08
"342","WDFW","11-8-12_TRIG_Conference Call_FINAL_notes","Brock Applegate",0.412455,2012,"terrestrial",2012-11-08
"343","Scott","11-8-12_TRIG_Conference Call_FINAL_notes","Haley Edwards",0.230631,2012,"terrestrial",2012-11-08
"344","PSE","11-8-12_TRIG_Conference Call_FINAL_notes","Ira McDaniel",0.475356,2012,"terrestrial",2012-11-08
"345","Skagit River System Coop","11-8-12_TRIG_Conference Call_FINAL_notes","Stan Walsh",0.484868,2012,"terrestrial",2012-11-08
"346","USFS","11-8-12_TRIG_Conference Call_FINAL_notes","Theresa Mathis",0.418833,2012,"terrestrial",2012-11-08
"347","PSE","11-8-12_TRIG_Conference Call_FINAL_notes","Tony Fuchs",0.807151,2012,"terrestrial",2012-11-08
"348","USFS","12-01-11_TRIG_FINAL_notes","Ann Risvold",0.159916,2011,"terrestrial",2011-12-01
"349","RMEF","12-01-11_TRIG_FINAL_notes","Bill Richardson",0.315235,2011,"terrestrial",2011-12-01
"350","WDFW","12-01-11_TRIG_FINAL_notes","Brock Applegate",0.438587,2011,"terrestrial",2011-12-01
"351","PSE","12-01-11_TRIG_FINAL_notes","Cary Feldmann",0.255824,2011,"terrestrial",2011-12-01
"352","Huckell/Weinman Associates","12-01-11_TRIG_FINAL_notes","Chris Lawson",0.190756,2011,"terrestrial",2011-12-01
"353","NWIFC","12-01-11_TRIG_FINAL_notes","Chris Madsen",0.202871,2011,"terrestrial",2011-12-01
"354",NA,"12-01-11_TRIG_FINAL_notes","Darius Heggins",0.196937,2011,"terrestrial",2011-12-01
"355","PSE","12-01-11_TRIG_FINAL_notes","Elizabeth Dubreuil",0.175848,2011,"terrestrial",2011-12-01
"356","Scott","12-01-11_TRIG_FINAL_notes","Haley Edwards",0.387194,2011,"terrestrial",2011-12-01
"357","PSE","12-01-11_TRIG_FINAL_notes","Ira McDaniel",0.236325,2011,"terrestrial",2011-12-01
"358","PDSA Consulting","12-01-11_TRIG_FINAL_notes","Jamie Riche",0.196925,2011,"terrestrial",2011-12-01
"359","Smayda Environmental Associates","12-01-11_TRIG_FINAL_notes","Kathy Smayda",0.325386,2011,"terrestrial",2011-12-01
"360","USFS","12-01-11_TRIG_FINAL_notes","Laura Potash Martin",0.225826,2011,"terrestrial",2011-12-01
"361","PSE","12-01-11_TRIG_FINAL_notes","Lisa Salton",0.194561,2011,"terrestrial",2011-12-01
"362","Joetta","12-01-11_TRIG_FINAL_notes","Mark Hitchcock",0.169942,2011,"terrestrial",2011-12-01
"363","Haley","12-01-11_TRIG_FINAL_notes","Mel Walters",0.170268,2011,"terrestrial",2011-12-01
"364","NCCC","12-01-11_TRIG_FINAL_notes","Patrick Goldsworthy",0.196154,2011,"terrestrial",2011-12-01
"365","Skagit River System Coop","12-01-11_TRIG_FINAL_notes","Stan Walsh",0.229721,2011,"terrestrial",2011-12-01
"366","WDFW","12-01-11_TRIG_FINAL_notes","Steve Desimone",0.218141,2011,"terrestrial",2011-12-01
"367","PSE","12-01-11_TRIG_FINAL_notes","Tony Fuchs",0.313763,2011,"terrestrial",2011-12-01
"368","RMEF","12-06-12_TRIG_FINAL_notes","Bill Richardson",0.266792,2012,"terrestrial",2012-12-06
"369","RMEF","12-06-12_TRIG_FINAL_notes","Bob Nelson",0.215378,2012,"terrestrial",2012-12-06
"370","WDFW","12-06-12_TRIG_FINAL_notes","Brock Applegate",0.478244,2012,"terrestrial",2012-12-06
"371","Scott","12-06-12_TRIG_FINAL_notes","Haley Edwards",0.343117,2012,"terrestrial",2012-12-06
"372","PSE","12-06-12_TRIG_FINAL_notes","Ira McDaniel",0.276626,2012,"terrestrial",2012-12-06
"373","PDSA Consulting","12-06-12_TRIG_FINAL_notes","Jamie Riche",0.239866,2012,"terrestrial",2012-12-06
"374",NA,"12-06-12_TRIG_FINAL_notes","Lauren Everest",0.218994,2012,"terrestrial",2012-12-06
"375","USFWS","12-06-12_TRIG_FINAL_notes","Lou Ellyn Jones",0.20106,2012,"terrestrial",2012-12-06
"376","Haley","12-06-12_TRIG_FINAL_notes","Scott Heller",0.459069,2012,"terrestrial",2012-12-06
"377","Skagit River System Coop","12-06-12_TRIG_FINAL_notes","Stan Walsh",0.289087,2012,"terrestrial",2012-12-06
"378","USFS","12-06-12_TRIG_FINAL_notes","Theresa Mathis",0.25408,2012,"terrestrial",2012-12-06
"379","PSE","12-06-12_TRIG_FINAL_notes","Tony Fuchs",0.929299,2012,"terrestrial",2012-12-06
"380","PSE","2000aquatic20000518","Arnie Aspelund",0.728293,2000,"aquatic/fish",2000-05-18
"381","SFEG","2000aquatic20000518","Arn Thoreen",0.319036,2000,"aquatic/fish",2000-05-18
"382","WDOE","2000aquatic20000518","Bob Newman",0.281227,2000,"aquatic/fish",2000-05-18
"383","USFS","2000aquatic20000518","Brady Green",0.294244,2000,"aquatic/fish",2000-05-18
"384","WDFW","2000aquatic20000518","Carol Bordin",0.304366,2000,"aquatic/fish",2000-05-18
"385","PSE","2000aquatic20000518","Cary Feldmann",0.301795,2000,"aquatic/fish",2000-05-18
"386","Skagit County","2000aquatic20000518","Derek Koellmann",0.260041,2000,"aquatic/fish",2000-05-18
"387","Fidalgo Fly Fishers","2000aquatic20000518","Dick Raisler",0.272895,2000,"aquatic/fish",2000-05-18
"388","WDFW","2000aquatic20000518","Gary Sprague",0.424532,2000,"aquatic/fish",2000-05-18
"389","City of Anacortes and Skagit County PUD","2000aquatic20000518","Jerry Louthain",0.285181,2000,"aquatic/fish",2000-05-18
"390","USFS","2000aquatic20000518","Kathy Anderson",0.310563,2000,"aquatic/fish",2000-05-18
"391","PDSA Consulting","2000aquatic20000518","Lyn Wiltse",0.281871,2000,"aquatic/fish",2000-05-18
"392","Town of Concrete","2000aquatic20000518","Paula Hartzell",0.288546,2000,"aquatic/fish",2000-05-18
"393","Puget Sound Anglers","2000aquatic20000518","Polly Fischer",0.287685,2000,"aquatic/fish",2000-05-18
"394","NPS","2000aquatic20000518","Reed Glesne",0.313101,2000,"aquatic/fish",2000-05-18
"395","Skagit River System Coop","2000aquatic20000518","Stan Walsh",0.298688,2000,"aquatic/fish",2000-05-18
"396","PSE","2000aquatic20000608","Arnie Aspelund",0.544023,2000,"aquatic/fish",2000-06-08
"397","SFEG","2000aquatic20000608","Arn Thoreen",0.237488,2000,"aquatic/fish",2000-06-08
"398","Wildcat Steelhead Club","2000aquatic20000608","Bill Reinard",0.236475,2000,"aquatic/fish",2000-06-08
"399","WDOE","2000aquatic20000608","Bob Newman",0.22366,2000,"aquatic/fish",2000-06-08
"400","USFS","2000aquatic20000608","Brady Green",0.219316,2000,"aquatic/fish",2000-06-08
"401","WDFW","2000aquatic20000608","Carol Bordin",0.335498,2000,"aquatic/fish",2000-06-08
"402","PSE","2000aquatic20000608","Cary Feldmann",0.22714,2000,"aquatic/fish",2000-06-08
"403","Fidalgo Fly Fishers","2000aquatic20000608","Dick Raisler",0.21542,2000,"aquatic/fish",2000-06-08
"404","PSE","2000aquatic20000608","Doug Bruland",0.225249,2000,"aquatic/fish",2000-06-08
"405","WDFW","2000aquatic20000608","Gary Sprague",0.439505,2000,"aquatic/fish",2000-06-08
"406",NA,"2000aquatic20000608","Jeff Cederholm",0.224476,2000,"aquatic/fish",2000-06-08
"407","USFS","2000aquatic20000608","Jon Vanderheyden",0.22671,2000,"aquatic/fish",2000-06-08
"408","PDSA Consulting","2000aquatic20000608","Lyn Wiltse",0.226476,2000,"aquatic/fish",2000-06-08
"409","Concrete School District","2000aquatic20000608","Michael Bruce",0.201161,2000,"aquatic/fish",2000-06-08
"410","PSE","2000aquatic20000608","Nick Verretto",0.246952,2000,"aquatic/fish",2000-06-08
"411","Puget Sound Anglers","2000aquatic20000608","Polly Fischer",0.225987,2000,"aquatic/fish",2000-06-08
"412","NPS","2000aquatic20000608","Reed Glesne",0.226132,2000,"aquatic/fish",2000-06-08
"413","WDOE","2000aquatic20000608","Rod Sakrison",0.232556,2000,"aquatic/fish",2000-06-08
"414","Skagit River System Coop","2000aquatic20000608","Stan Walsh",0.235723,2000,"aquatic/fish",2000-06-08
"415","PSE","2000aquatic20000713","Arnie Aspelund",0.30125,2000,"aquatic/fish",2000-07-13
"416","SFEG","2000aquatic20000713","Arn Thoreen",0.229317,2000,"aquatic/fish",2000-07-13
"417","PSE","2000aquatic20000713","Barb Gassler",0.239838,2000,"aquatic/fish",2000-07-13
"418","Wildcat Steelhead Club","2000aquatic20000713","Bill Reinard",0.240747,2000,"aquatic/fish",2000-07-13
"419","PSE","2000aquatic20000713","Bob Barnes",0.25691,2000,"aquatic/fish",2000-07-13
"420",NA,"2000aquatic20000713","Bob Rose",0.229751,2000,"aquatic/fish",2000-07-13
"421","USFS","2000aquatic20000713","Brady Green",0.350086,2000,"aquatic/fish",2000-07-13
"422","WDFW","2000aquatic20000713","Carol Bordin",0.288543,2000,"aquatic/fish",2000-07-13
"423","USACE","2000aquatic20000713","Chuck Ebel",0.360807,2000,"aquatic/fish",2000-07-13
"424","Fidalgo Fly Fishers","2000aquatic20000713","Dick Raisler",0.216571,2000,"aquatic/fish",2000-07-13
"425","Trout Unlimited","2000aquatic20000713","Don Schluter",0.312411,2000,"aquatic/fish",2000-07-13
"426","Skagit County Economic Development Assoc.","2000aquatic20000713","Don Wick",0.23055,2000,"aquatic/fish",2000-07-13
"427","PSE","2000aquatic20000713","Doug Bruland",0.225998,2000,"aquatic/fish",2000-07-13
"428","USFWS","2000aquatic20000713","Fred Seavey",0.36524,2000,"aquatic/fish",2000-07-13
"429","WDOT","2000aquatic20000713","Gary Davis",0.205106,2000,"aquatic/fish",2000-07-13
"430","WDFW","2000aquatic20000713","Gary Sprague",0.231645,2000,"aquatic/fish",2000-07-13
"431","City of Anacortes and Skagit County PUD","2000aquatic20000713","Jerry Louthain",0.227224,2000,"aquatic/fish",2000-07-13
"432","IAC","2000aquatic20000713","Jim Eychaner",0.213229,2000,"aquatic/fish",2000-07-13
"433","USFS","2000aquatic20000713","Jon Vanderheyden",0.227817,2000,"aquatic/fish",2000-07-13
"434","PDSA Consulting","2000aquatic20000713","Lyn Wiltse",0.227116,2000,"aquatic/fish",2000-07-13
"435","Concrete School District","2000aquatic20000713","Marie Phillips",0.303176,2000,"aquatic/fish",2000-07-13
"436",NA,"2000aquatic20000713","Nick Arnie",0.256255,2000,"aquatic/fish",2000-07-13
"437","PSE","2000aquatic20000713","Nick Verretto",0.230744,2000,"aquatic/fish",2000-07-13
"438","Puget Sound Anglers","2000aquatic20000713","Polly Fischer",0.226994,2000,"aquatic/fish",2000-07-13
"439","NPS","2000aquatic20000713","Reed Glesne",0.227287,2000,"aquatic/fish",2000-07-13
"440",NA,"2000aquatic20000713","Rob Masonis",0.224887,2000,"aquatic/fish",2000-07-13
"441","WDOE","2000aquatic20000713","Rod Sakrison",0.288086,2000,"aquatic/fish",2000-07-13
"442","Skagit River System Coop","2000aquatic20000713","Stan Walsh",0.236679,2000,"aquatic/fish",2000-07-13
"443","NMFS","2000aquatic20000713","Steve Fransen",0.198237,2000,"aquatic/fish",2000-07-13
"444","WDNR","2000aquatic20000713","Steve Jennison",0.362838,2000,"aquatic/fish",2000-07-13
"445","W","2000aquatic20000914","A.J. Malk",0.22067,2000,"aquatic/fish",2000-09-14
"446","USFS","2000aquatic20000914","Brady Green",0.354714,2000,"aquatic/fish",2000-09-14
"447","PSE","2000aquatic20000914","Ed Schild",0.9057,2000,"aquatic/fish",2000-09-14
"448","PSE","2000aquatic20000914","Joel Molander",0.772072,2000,"aquatic/fish",2000-09-14
"449",NA,"2000aquatic20000914","R.C. Szaro",0.231817,2000,"aquatic/fish",2000-09-14
"450","R","2000aquatic20000914","W.T. Sexton",0.218357,2000,"aquatic/fish",2000-09-14
"451","PSE","2000aquatic20001012","Bob Barnes",0.689236,2000,"aquatic/fish",2000-10-12
"452","TNC","2000aquatic20001012","Bob Carey",0.420914,2000,"aquatic/fish",2000-10-12
"453","USFS","2000aquatic20001012","Brady Green",0.385497,2000,"aquatic/fish",2000-10-12
"454","PDSA Consulting","2000aquatic20001109","Lyn Wiltse",0.67546,2000,"aquatic/fish",2000-11-09
"455","USACE","2000aquatic20001109","Wayne Wagner",0.433687,2000,"aquatic/fish",2000-11-09
"456","PSE","2000aquatic20001214","Arnie Aspelund",0.847894,2000,"aquatic/fish",2000-12-14
"457","Wildcat Steelhead Club","2000aquatic20001214","Bill Reinard",0.373143,2000,"aquatic/fish",2000-12-14
"458","PSE","2000aquatic20001214","Bob Barnes",0.277648,2000,"aquatic/fish",2000-12-14
"459","USFS","2000aquatic20001214","Brady Green",0.329425,2000,"aquatic/fish",2000-12-14
"460","Environmental Agreements","2000aquatic20001214","Bruce Freet",0.241116,2000,"aquatic/fish",2000-12-14
"461","PSE","2000aquatic20001214","Cary Feldmann",0.280972,2000,"aquatic/fish",2000-12-14
"462","USACE","2000aquatic20001214","Chuck Ebel",0.279335,2000,"aquatic/fish",2000-12-14
"463","NMFS","2000aquatic20001214","Dayna Matthews",0.319333,2000,"aquatic/fish",2000-12-14
"464","Fidalgo Fly Fishers","2000aquatic20001214","Dick Raisler",0.279842,2000,"aquatic/fish",2000-12-14
"465","Trout Unlimited","2000aquatic20001214","Don Schluter",0.280782,2000,"aquatic/fish",2000-12-14
"466","PSE","2000aquatic20001214","Doug Bruland",0.278942,2000,"aquatic/fish",2000-12-14
"467","WDFW","2000aquatic20001214","Karen Kloempken",0.409358,2000,"aquatic/fish",2000-12-14
"468","PSE","2000aquatic20001214","Lloyd Pernela",0.359814,2000,"aquatic/fish",2000-12-14
"469","PDSA Consulting","2000aquatic20001214","Lyn Wiltse",0.624052,2000,"aquatic/fish",2000-12-14
"470",NA,"2000aquatic20001214","Mark Hummel",0.278169,2000,"aquatic/fish",2000-12-14
"471","PSE","2000aquatic20001214","Nick Verretto",0.583773,2000,"aquatic/fish",2000-12-14
"472","WDOE","2000aquatic20001214","Rod Sakrison",0.278976,2000,"aquatic/fish",2000-12-14
"473","Skagit River System Coop","2000aquatic20001214","Stan Walsh",0.694435,2000,"aquatic/fish",2000-12-14
"474","WDNR","2000aquatic20001214","Steve Jennison",0.279606,2000,"aquatic/fish",2000-12-14
"475","R2 Resource Consultants","2000aquatic20001214","Sue Madsen",0.288674,2000,"aquatic/fish",2000-12-14
"476","PSE","2000aquatictech20000516","Bob Barnes",0.402121,2000,"aquatic/fish",2000-05-16
"477","PSE","2000aquatictech20000516","Cary Feldmann",0.279898,2000,"aquatic/fish",2000-05-16
"478","NMFS","2000aquatictech20000516","Ed Meyer",0.356058,2000,"aquatic/fish",2000-05-16
"479","USFWS","2000aquatictech20000516","Fred Seavey",0.546554,2000,"aquatic/fish",2000-05-16
"480","WDFW","2000aquatictech20000516","Gary Sprague",0.306496,2000,"aquatic/fish",2000-05-16
"481","PSE","2000aquatictech20000516","Kevin Brink",0.537589,2000,"aquatic/fish",2000-05-16
"482","PDSA Consulting","2000aquatictech20000516","Lyn Wiltse",0.449548,2000,"aquatic/fish",2000-05-16
"483","MWH","2000aquatictech20000516","Mort McMillen",0.29103,2000,"aquatic/fish",2000-05-16
"484","PSE","2000aquatictech20000516","Nick Verretto",0.934741,2000,"aquatic/fish",2000-05-16
"485","Skagit River System Coop","2000aquatictech20000516","Stan Walsh",0.454785,2000,"aquatic/fish",2000-05-16
"486","PSE","2000aquatictech20000516","Wayne Porter",0.27227,2000,"aquatic/fish",2000-05-16
"487","PSE","2000aquatictech20000613","Arnie Aspelund",0.278226,2000,"aquatic/fish",2000-06-13
"488","PSE","2000aquatictech20000613","Bob Barnes",0.26742,2000,"aquatic/fish",2000-06-13
"489","PSE","2000aquatictech20000613","Cary Feldmann",0.273472,2000,"aquatic/fish",2000-06-13
"490","Ray","2000aquatictech20000613","Dennis Dorratcague",0.356982,2000,"aquatic/fish",2000-06-13
"491","NMFS","2000aquatictech20000613","Ed Meyer",0.268369,2000,"aquatic/fish",2000-06-13
"492","USFWS","2000aquatictech20000613","Fred Seavey",0.332586,2000,"aquatic/fish",2000-06-13
"493","WDFW","2000aquatictech20000613","Gary Sprague",0.368288,2000,"aquatic/fish",2000-06-13
"494","WDFW","2000aquatictech20000613","Ken Bates",0.307733,2000,"aquatic/fish",2000-06-13
"495","PSE","2000aquatictech20000613","Kevin Brink",0.449975,2000,"aquatic/fish",2000-06-13
"496","PDSA Consulting","2000aquatictech20000613","Lyn Wiltse",0.272394,2000,"aquatic/fish",2000-06-13
"497","PSE","2000aquatictech20000613","Nick Verretto",0.860648,2000,"aquatic/fish",2000-06-13
"498","Skagit River System Coop","2000aquatictech20000613","Stan Walsh",0.381142,2000,"aquatic/fish",2000-06-13
"499","NMFS","2000aquatictech20000613","Steve Fransen",0.270187,2000,"aquatic/fish",2000-06-13
"500","PSE","2000aquatictech20000613","Wayne Porter",0.268205,2000,"aquatic/fish",2000-06-13
"501","PSE","2000aquatictech20000726","Arnie Aspelund",0.260412,2000,"aquatic/fish",2000-07-26
"502","PSE","2000aquatictech20000726","Cary Feldmann",0.371844,2000,"aquatic/fish",2000-07-26
"503","PSE","2000aquatictech20000726","Doug Bruland",0.279075,2000,"aquatic/fish",2000-07-26
"504","NMFS","2000aquatictech20000726","Ed Meyer",0.277146,2000,"aquatic/fish",2000-07-26
"505","USFWS","2000aquatictech20000726","Fred Seavey",0.436359,2000,"aquatic/fish",2000-07-26
"506","WDFW","2000aquatictech20000726","Gary Sprague",0.325167,2000,"aquatic/fish",2000-07-26
"507","WDFW","2000aquatictech20000726","Ken Bates",0.31602,2000,"aquatic/fish",2000-07-26
"508","PSE","2000aquatictech20000726","Kevin Brink",0.49343,2000,"aquatic/fish",2000-07-26
"509","PDSA Consulting","2000aquatictech20000726","Lyn Wiltse",0.280696,2000,"aquatic/fish",2000-07-26
"510","MWH","2000aquatictech20000726","Mort McMillen",0.271158,2000,"aquatic/fish",2000-07-26
"511","PSE","2000aquatictech20000726","Nick Verretto",0.732409,2000,"aquatic/fish",2000-07-26
"512","Skagit River System Coop","2000aquatictech20000726","Stan Walsh",0.40588,2000,"aquatic/fish",2000-07-26
"513","NMFS","2000aquatictech20000726","Steve Fransen",0.278101,2000,"aquatic/fish",2000-07-26
"514","PSE","2000aquatictech20000831","Arnie Aspelund",0.290388,2000,"aquatic/fish",2000-08-31
"515","PSE","2000aquatictech20000831","Cary Feldmann",0.29488,2000,"aquatic/fish",2000-08-31
"516","WDFW","2000aquatictech20000831","Gary Sprague",0.363633,2000,"aquatic/fish",2000-08-31
"517","WDFW","2000aquatictech20000831","Ken Bates",0.336636,2000,"aquatic/fish",2000-08-31
"518","PSE","2000aquatictech20000831","Kevin Brink",0.472198,2000,"aquatic/fish",2000-08-31
"519","PDSA Consulting","2000aquatictech20000831","Lyn Wiltse",0.289138,2000,"aquatic/fish",2000-08-31
"520","Univ","2000aquatictech20000831","Mike Brett",0.292076,2000,"aquatic/fish",2000-08-31
"521","PSE","2000aquatictech20000831","Nick Verretto",0.596766,2000,"aquatic/fish",2000-08-31
"522","Skagit River System Coop","2000aquatictech20000831","Stan Walsh",0.286449,2000,"aquatic/fish",2000-08-31
"523","NMFS","2000aquatictech20000831","Steve Fransen",0.286744,2000,"aquatic/fish",2000-08-31
"524","PSE","2000aquatictech20000831","Wayne Porter",0.303278,2000,"aquatic/fish",2000-08-31
"525","PSE","2000aquatictech20000928","Arnie Aspelund",0.249386,2000,"aquatic/fish",2000-09-28
"526","PSE","2000aquatictech20000928","Cary Feldmann",0.276387,2000,"aquatic/fish",2000-09-28
"527","Ray","2000aquatictech20000928","Dennis Dorratcague",0.197064,2000,"aquatic/fish",2000-09-28
"528","PSE","2000aquatictech20000928","Doug Bruland",0.29857,2000,"aquatic/fish",2000-09-28
"529","NMFS","2000aquatictech20000928","Ed Meyer",0.204493,2000,"aquatic/fish",2000-09-28
"530","USFWS","2000aquatictech20000928","Fred Seavey",0.361553,2000,"aquatic/fish",2000-09-28
"531","WDFW","2000aquatictech20000928","Ken Bates",0.846429,2000,"aquatic/fish",2000-09-28
"532","PSE","2000aquatictech20000928","Kevin Brink",0.311828,2000,"aquatic/fish",2000-09-28
"533","PDSA Consulting","2000aquatictech20000928","Lyn Wiltse",0.216331,2000,"aquatic/fish",2000-09-28
"534","MWH","2000aquatictech20000928","Mort McMillen",0.285678,2000,"aquatic/fish",2000-09-28
"535","PSE","2000aquatictech20000928","Nick Verretto",0.493005,2000,"aquatic/fish",2000-09-28
"536","Skagit River System Coop","2000aquatictech20000928","Stan Walsh",0.205516,2000,"aquatic/fish",2000-09-28
"537","NMFS","2000aquatictech20000928","Steve Fransen",0.292898,2000,"aquatic/fish",2000-09-28
"538","PSE","2000aquatictech20000928","Wayne Porter",0.271515,2000,"aquatic/fish",2000-09-28
"539","PSE","2000aquatictech20001019","Arnie Aspelund",0.352529,2000,"aquatic/fish",2000-10-19
"540","PSE","2000aquatictech20001019","Cary Feldmann",0.606293,2000,"aquatic/fish",2000-10-19
"541","PSE","2000aquatictech20001019","Doug Bruland",0.42158,2000,"aquatic/fish",2000-10-19
"542","NMFS","2000aquatictech20001019","Ed Meyer",0.412051,2000,"aquatic/fish",2000-10-19
"543","WDFW","2000aquatictech20001019","Gary Sprague",0.430459,2000,"aquatic/fish",2000-10-19
"544","USFWS","2000aquatictech20001019","Jim Stow",0.297173,2000,"aquatic/fish",2000-10-19
"545","WDFW","2000aquatictech20001019","Ken Bates",0.322174,2000,"aquatic/fish",2000-10-19
"546","PSE","2000aquatictech20001019","Kevin Brink",0.492218,2000,"aquatic/fish",2000-10-19
"547","MWH","2000aquatictech20001019","Mort McMillen",0.439507,2000,"aquatic/fish",2000-10-19
"548","PSE","2000aquatictech20001019","Nick Verretto",0.430367,2000,"aquatic/fish",2000-10-19
"549","Skagit River System Coop","2000aquatictech20001019","Stan Walsh",0.29776,2000,"aquatic/fish",2000-10-19
"550","PSE","2000aquatictech20001019","Wayne Porter",0.295514,2000,"aquatic/fish",2000-10-19
"551","PSE","2000cultural20000525","Connie Freeland",0.575654,2000,"cultural",2000-05-25
"552","Historical Research Associates","2000cultural20000525","Gail Thompson",0.289918,2000,"cultural",2000-05-25
"553","Concrete Heritage Museum","2000cultural20000525","John Boggs",0.361327,2000,"cultural",2000-05-25
"554","USFS","2000cultural20000525","Kathy Anderson",0.288303,2000,"cultural",2000-05-25
"555","Swinomish Indian Tribe","2000cultural20000525","Larry Campbell",0.285476,2000,"cultural",2000-05-25
"556","PDSA Consulting","2000cultural20000525","Lyn Wiltse",0.285937,2000,"cultural",2000-05-25
"557","Town of Concrete","2000cultural20000525","Paula Hartzell",0.294527,2000,"cultural",2000-05-25
"558","PSE","2000cultural20000620","Connie Freeland",0.340792,2000,"cultural",2000-06-20
"559","Concrete Heritage Museum","2000cultural20000620","Gail Boggs",0.305946,2000,"cultural",2000-06-20
"560","Historical Research Associates","2000cultural20000620","Gail Thompson",0.294645,2000,"cultural",2000-06-20
"561","Sauk-Suiattle Indian Tribe","2000cultural20000620","Jason Joseph",0.345069,2000,"cultural",2000-06-20
"562","PSE","2000cultural20000620","Jessie Piper",0.284452,2000,"cultural",2000-06-20
"563","Concrete Heritage Museum","2000cultural20000620","John Boggs",0.291248,2000,"cultural",2000-06-20
"564","USFS","2000cultural20000620","Kathy Anderson",0.256432,2000,"cultural",2000-06-20
"565","PDSA Consulting","2000cultural20000620","Lyn Wiltse",0.28628,2000,"cultural",2000-06-20
"566","WAHP","2000cultural20000620","Rob Whitlam",0.281438,2000,"cultural",2000-06-20
"567",NA,"2000cultural20000620","Samish Connie",0.758856,2000,"cultural",2000-06-20
"568","North Cascades Institute","2000cultural20000620","Saul Weisberg",0.355893,2000,"cultural",2000-06-20
"569","Upper Skagit Indian Tribe","2000cultural20000620","Scott Schuyler",0.334587,2000,"cultural",2000-06-20
"570","PSE","2000cultural20000718","Bill Gaines",0.328623,2000,"cultural",2000-07-18
"571","NPS","2000cultural20000718","Bob Mierendorf",0.251093,2000,"cultural",2000-07-18
"572","USFS","2000cultural20000718","Carl Corey",0.294315,2000,"cultural",2000-07-18
"573","PSE","2000cultural20000718","Connie Freeland",0.637565,2000,"cultural",2000-07-18
"574","PSE","2000cultural20000718","Ed Schild",0.29111,2000,"cultural",2000-07-18
"575","Historical Research Associates","2000cultural20000718","Gail Thompson",0.582708,2000,"cultural",2000-07-18
"576","Skagit County Planning and Permit Center","2000cultural20000718","Guy McNally",0.253105,2000,"cultural",2000-07-18
"577","PSE","2000cultural20000718","Jessie Piper",0.586804,2000,"cultural",2000-07-18
"578","PSE","2000cultural20000718","Joel Molander",0.280947,2000,"cultural",2000-07-18
"579","PDSA Consulting","2000cultural20000718","Lyn Wiltse",0.298322,2000,"cultural",2000-07-18
"580","Mt. Adams Ranger Station","2000cultural20000718","Rick McClure",0.441676,2000,"cultural",2000-07-18
"581","WAHP","2000cultural20000718","Rob Whitlam",0.287559,2000,"cultural",2000-07-18
"582","North Cascades Institute","2000cultural20000718","Saul Weisberg",0.367496,2000,"cultural",2000-07-18
"583","W","2000cultural20000919","A.J. Malk",0.2313,2000,"cultural",2000-09-19
"584","PSE","2000cultural20000919","Bill Gaines",0.29742,2000,"cultural",2000-09-19
"585","PSE","2000cultural20000919","Bob Barnes",0.284615,2000,"cultural",2000-09-19
"586","Environmental Agreements","2000cultural20000919","Bruce Freet",0.25744,2000,"cultural",2000-09-19
"587","PSE","2000cultural20000919","Ed Schild",0.891242,2000,"cultural",2000-09-19
"588","Skagit County Planning and Permit Center","2000cultural20000919","Guy McNally",0.283436,2000,"cultural",2000-09-19
"589","USFS","2000cultural20000919","Jan Hollenbeck",0.294879,2000,"cultural",2000-09-19
"590",NA,"2000cultural20000919","Mark Hummel",0.307342,2000,"cultural",2000-09-19
"591",NA,"2000cultural20000919","R.C. Szaro",0.241977,2000,"cultural",2000-09-19
"592","Mt. Adams Ranger Station","2000cultural20000919","Rick McClure",0.480292,2000,"cultural",2000-09-19
"593","WAHP","2000cultural20000919","Rob Whitlam",0.344512,2000,"cultural",2000-09-19
"594","R","2000cultural20000919","W.T. Sexton",0.228526,2000,"cultural",2000-09-19
"595","PSE","2000cultural20001017","Bob Barnes",0.287739,2000,"cultural",2000-10-17
"596","PSE","2000cultural20001017","Connie Freeland",0.28586,2000,"cultural",2000-10-17
"597","Concrete Heritage Museum","2000cultural20001017","Gail Boggs",0.391794,2000,"cultural",2000-10-17
"598","Historical Research Associates","2000cultural20001017","Gail Thompson",0.306495,2000,"cultural",2000-10-17
"599","USFS","2000cultural20001017","Jan Hollenbeck",0.360398,2000,"cultural",2000-10-17
"600","PSE","2000cultural20001017","Jessie Piper",0.550387,2000,"cultural",2000-10-17
"601","Skagit County Historical Museum","2000cultural20001017","Karen Marshall",0.360152,2000,"cultural",2000-10-17
"602","Swinomish Indian Tribe","2000cultural20001017","Larry Campbell",0.383721,2000,"cultural",2000-10-17
"603","PDSA Consulting","2000cultural20001017","Lyn Wiltse",0.311057,2000,"cultural",2000-10-17
"604","Town of Concrete","2000cultural20001017","Paul Schissler",0.308208,2000,"cultural",2000-10-17
"605","Mt. Adams Ranger Station","2000cultural20001017","Rick McClure",0.297358,2000,"cultural",2000-10-17
"606","WAHP","2000cultural20001017","Rob Whitlam",0.290117,2000,"cultural",2000-10-17
"607","Sauk-Suiattle Indian Tribe","2000cultural20001017","Shari Brewer",0.297986,2000,"cultural",2000-10-17
"608","HRA","2000cultural20001121","Alex Maass",0.47068,2000,"cultural",2000-11-21
"609","PSE","2000cultural20001121","Bob Barnes",0.289387,2000,"cultural",2000-11-21
"610","NPS","2000cultural20001121","Bob Mierendorf",0.386157,2000,"cultural",2000-11-21
"611","PSE","2000cultural20001212","Bob Barnes",0.280382,2000,"cultural",2000-12-12
"612","NPS","2000cultural20001212","Bob Mierendorf",0.294382,2000,"cultural",2000-12-12
"613","USFS","2000cultural20001212","Jan Hollenbeck",0.34269,2000,"cultural",2000-12-12
"614","Upper Skagit Indian Tribe","2000cultural20001212","Scott Schuyler",0.459184,2000,"cultural",2000-12-12
"615","PSE","2000economic20000607","Charles Morton",0.301653,2000,"economic",2000-06-07
"616","USFS","2000economic20000607","Chris Hansen-Murray",0.289892,2000,"economic",2000-06-07
"617","USFWS","2000economic20000607","Fred Seavey",0.223868,2000,"economic",2000-06-07
"618","WDFW","2000economic20000607","Gary Sprague",0.287449,2000,"economic",2000-06-07
"619","USFS","2000economic20000607","Jon Vanderheyden",0.300316,2000,"economic",2000-06-07
"620","PSE","2000economic20000607","Kevin Brink",0.496596,2000,"economic",2000-06-07
"621","PDSA Consulting","2000economic20000607","Lyn Wiltse",0.228064,2000,"economic",2000-06-07
"622","Skagit River System Coop","2000economic20000607","Stan Walsh",0.359894,2000,"economic",2000-06-07
"623","NMFS","2000economic20000607","Steve Fransen",0.276394,2000,"economic",2000-06-07
"624","Skagit County Emergency Management","2000economic20000607","Tom Sheahan",0.316447,2000,"economic",2000-06-07
"625","Hydro Consultant","2000economic20000607","Tom Spicher",0.236709,2000,"economic",2000-06-07
"626","USACE","2000economic20000607","Wayne Wagner",0.288517,2000,"economic",2000-06-07
"627","PSE","2000economic20000712","Barb Gassler",0.32112,2000,"economic",2000-07-12
"628","PSE","2000economic20000712","Charles Morton",0.382995,2000,"economic",2000-07-12
"629","USFS","2000economic20000712","Chris Hansen-Murray",0.295855,2000,"economic",2000-07-12
"630","PSE","2000economic20000712","Ed Schild",0.28985,2000,"economic",2000-07-12
"631","USACE","2000economic20000712","Eric Winter",0.262316,2000,"economic",2000-07-12
"632","USFWS","2000economic20000712","Fred Seavey",0.297397,2000,"economic",2000-07-12
"633","WDFW","2000economic20000712","Gary Sprague",0.322572,2000,"economic",2000-07-12
"634","Fred","2000economic20000712","Jackie Vanderveen",0.294568,2000,"economic",2000-07-12
"635","Hydro consultant with diverse background","2000economic20000712","Jim Sinclair",0.363171,2000,"economic",2000-07-12
"636","PSE","2000economic20000712","Joel Molander",0.333766,2000,"economic",2000-07-12
"637","USFS","2000economic20000712","Jon Vanderheyden",0.293131,2000,"economic",2000-07-12
"638","PDSA Consulting","2000economic20000712","Lyn Wiltse",0.426645,2000,"economic",2000-07-12
"639","Town of Concrete","2000economic20000712","Paul Schissler",0.276945,2000,"economic",2000-07-12
"640",NA,"2000economic20000712","Rick Rogers",0.26333,2000,"economic",2000-07-12
"641","Skagit River System Coop","2000economic20000712","Stan Walsh",0.298067,2000,"economic",2000-07-12
"642","NMFS","2000economic20000712","Steve Fransen",0.436745,2000,"economic",2000-07-12
"643","Skagit County Emergency Management","2000economic20000712","Tom Sheahan",0.483285,2000,"economic",2000-07-12
"644","Hydro Consultant","2000economic20000712","Tom Spicher",0.339631,2000,"economic",2000-07-12
"645","USACE","2000economic20000712","Wayne Wagner",0.278537,2000,"economic",2000-07-12
"646","Environmental Agreements","2000economic20000920","Bruce Freet",0.249769,2000,"economic",2000-09-20
"647",NA,"2000economic20000920","Mark Hummel",0.301026,2000,"economic",2000-09-20
"648","PSE","2000economic20001011","Bob Barnes",0.314758,2000,"economic",2000-10-11
"649","Citizen","2000economic20001011","Bob Helton",0.341027,2000,"economic",2000-10-11
"650","PSE","2000economic20001011","Kevin Brink",0.40171,2000,"economic",2000-10-11
"651","PDSA Consulting","2000economic20001011","Lyn Wiltse",0.277479,2000,"economic",2000-10-11
"652","Town of Concrete","2000economic20001011","Paul Schissler",0.275838,2000,"economic",2000-10-11
"653","Skagit River System Coop","2000economic20001011","Stan Walsh",0.253668,2000,"economic",2000-10-11
"654","Hydro Consultant","2000economic20001011","Tom Spicher",0.252787,2000,"economic",2000-10-11
"655","PSE","2000economic20001108","Bob Barnes",0.360348,2000,"economic",2000-11-08
"656","USACE","2000economic20001108","Wayne Wagner",0.40808,2000,"economic",2000-11-08
"657","PSE","2000fish20000301","Arnie Aspelund",0.196292,2000,"aquatic/fish",2000-03-01
"658","PSE","2000fish20000301","Cary Feldmann",0.605358,2000,"aquatic/fish",2000-03-01
"659","Ray","2000fish20000301","Dennis Dorratcague",0.237912,2000,"aquatic/fish",2000-03-01
"660","PSE","2000fish20000301","Doug Bruland",0.255227,2000,"aquatic/fish",2000-03-01
"661","NMFS","2000fish20000301","Ed Meyer",0.57005,2000,"aquatic/fish",2000-03-01
"662","WDFW","2000fish20000301","Gary Sprague",0.266864,2000,"aquatic/fish",2000-03-01
"663","WDFW","2000fish20000301","Ken Bates",0.328973,2000,"aquatic/fish",2000-03-01
"664","PSE","2000fish20000301","Kevin Brink",0.238678,2000,"aquatic/fish",2000-03-01
"665","PSE","2000fish20000301","Nick Verretto",0.176048,2000,"aquatic/fish",2000-03-01
"666","Skagit River System Coop","2000fish20000301","Stan Walsh",0.184187,2000,"aquatic/fish",2000-03-01
"667","PSE","2000fish20000301","Wayne Porter",0.174515,2000,"aquatic/fish",2000-03-01
"668","PSE","2000fish20000406","Arnie Aspelund",0.227457,2000,"aquatic/fish",2000-04-06
"669","PSE","2000fish20000406","Cary Feldmann",0.217584,2000,"aquatic/fish",2000-04-06
"670","Ray","2000fish20000406","Dennis Dorratcague",0.20205,2000,"aquatic/fish",2000-04-06
"671","PSE","2000fish20000406","Doug Bruland",0.202522,2000,"aquatic/fish",2000-04-06
"672","NMFS","2000fish20000406","Ed Meyer",0.220947,2000,"aquatic/fish",2000-04-06
"673","USFWS","2000fish20000406","Fred Seavey",0.217779,2000,"aquatic/fish",2000-04-06
"674","WDFW","2000fish20000406","Gary Sprague",0.201765,2000,"aquatic/fish",2000-04-06
"675","WDFW","2000fish20000406","Ken Bates",0.221868,2000,"aquatic/fish",2000-04-06
"676","PSE","2000fish20000406","Kevin Brink",0.202302,2000,"aquatic/fish",2000-04-06
"677","MWH","2000fish20000406","Mort McMillen",0.219341,2000,"aquatic/fish",2000-04-06
"678","PSE","2000fish20000406","Nick Verretto",0.201196,2000,"aquatic/fish",2000-04-06
"679","Skagit River System Coop","2000fish20000406","Stan Walsh",0.21166,2000,"aquatic/fish",2000-04-06
"680","NMFS","2000fish20000406","Steve Fransen",0.221676,2000,"aquatic/fish",2000-04-06
"681","PSE","2000fish20000406","Wayne Porter",0.199562,2000,"aquatic/fish",2000-04-06
"682","Environmental Agreements","2000process20000531","Bruce Freet",0.231581,2000,"admin",2000-05-31
"683","PSE","2000process20000531","Connie Freeland",0.371418,2000,"admin",2000-05-31
"684","WDFW","2000process20000531","Gary Sprague",0.154837,2000,"admin",2000-05-31
"685","Concrete Heritage Museum","2000process20000531","John Boggs",0.153732,2000,"admin",2000-05-31
"686","USFS","2000process20000531","Kathy Anderson",0.196453,2000,"admin",2000-05-31
"687","Town of Concrete","2000process20000531","Paula Hartzell",0.15701,2000,"admin",2000-05-31
"688","Skagit River System Coop","2000process20000531","Stan Walsh",0.154907,2000,"admin",2000-05-31
"689","PSE","2000public20000330","Cary Feldmann",0.181982,2000,"public/general",2000-03-30
"690","PSE","2000public20000330","Connie Freeland",0.18529,2000,"public/general",2000-03-30
"691","PSE","2000public20000330","Ed Schild",0.177129,2000,"public/general",2000-03-30
"692","PSE","2000public20000426","Bob Barnes",0.290232,2000,"public/general",2000-04-26
"693","PSE","2000public20000426","Cary Feldmann",0.260629,2000,"public/general",2000-04-26
"694","PSE","2000public20000426","Charles Morton",0.279013,2000,"public/general",2000-04-26
"695","PSE","2000public20000426","Chris Drechsel",0.296836,2000,"public/general",2000-04-26
"696","PSE","2000public20000426","Connie Freeland",0.351228,2000,"public/general",2000-04-26
"697","PSE","2000public20000725","Cary Feldmann",0.225888,2000,"public/general",2000-07-25
"698","PSE","2000public20000725","Chris Drechsel",0.220295,2000,"public/general",2000-07-25
"699","PSE","2000public20000725","Connie Freeland",0.324836,2000,"public/general",2000-07-25
"700","USFS","2000public20000725","Kathy Anderson",0.208257,2000,"public/general",2000-07-25
"701","PSE","2000public20000725","Tony Fuchs",0.213162,2000,"public/general",2000-07-25
"702","PSE","2000recreational20000523","Chris Drechsel",0.354063,2000,"recreational",2000-05-23
"703","Huckell/Weinman Associates","2000recreational20000523","Chris Lawson",0.30884,2000,"recreational",2000-05-23
"704","Miller Consulting","2000recreational20000523","Curt Miller",0.380102,2000,"recreational",2000-05-23
"705","NPS","2000recreational20000523","Dan Haas",0.357086,2000,"recreational",2000-05-23
"706","Van De Vanter Group","2000recreational20000523","Jamie Van De Vanter",0.385946,2000,"recreational",2000-05-23
"707","IAC","2000recreational20000523","Jim Eychaner",0.364637,2000,"recreational",2000-05-23
"708","USFS","2000recreational20000523","Kathy Anderson",0.348298,2000,"recreational",2000-05-23
"709","Osprey Environmental Services, Inc.","2000recreational20000523","Ken Wilcox",0.368319,2000,"recreational",2000-05-23
"710","NPS","2000recreational20000523","Leslie Finlayson",0.281926,2000,"recreational",2000-05-23
"711","PSE","2000recreational20000523","Lynn Mills",0.340037,2000,"recreational",2000-05-23
"712","PDSA Consulting","2000recreational20000523","Lyn Wiltse",0.277076,2000,"recreational",2000-05-23
"713","USFS","2000recreational20000615","Ann Dunphy",0.369752,2000,"recreational",2000-06-15
"714","PSE","2000recreational20000615","Cary Feldmann",0.227335,2000,"recreational",2000-06-15
"715","PSE","2000recreational20000615","Chris Drechsel",0.302358,2000,"recreational",2000-06-15
"716","Huckell/Weinman Associates","2000recreational20000615","Chris Lawson",0.290617,2000,"recreational",2000-06-15
"717","Miller Consulting","2000recreational20000615","Curt Miller",0.247612,2000,"recreational",2000-06-15
"718","NPS","2000recreational20000615","Dan Haas",0.228199,2000,"recreational",2000-06-15
"719","Van De Vanter Group","2000recreational20000615","Jamie Van De Vanter",0.251826,2000,"recreational",2000-06-15
"720","USFS","2000recreational20000615","Jon Vanderheyden",0.225798,2000,"recreational",2000-06-15
"721","Osprey Environmental Services, Inc.","2000recreational20000615","Ken Wilcox",0.241398,2000,"recreational",2000-06-15
"722","WDFW","2000recreational20000615","Lauri Vigue",0.247012,2000,"recreational",2000-06-15
"723","PSE","2000recreational20000615","Lynn Mills",0.313535,2000,"recreational",2000-06-15
"724","PDSA Consulting","2000recreational20000615","Lyn Wiltse",0.226015,2000,"recreational",2000-06-15
"725","WA State Parks","2000recreational20000615","Ted Smith",0.222567,2000,"recreational",2000-06-15
"726","USFS","2000recreational20000724","Ann Dunphy",0.476343,2000,"recreational",2000-07-24
"727","PSE","2000recreational20000724","Chris Drechsel",0.270246,2000,"recreational",2000-07-24
"728","Huckell/Weinman Associates","2000recreational20000724","Chris Lawson",0.330808,2000,"recreational",2000-07-24
"729","Miller Consulting","2000recreational20000724","Curt Miller",0.297888,2000,"recreational",2000-07-24
"730","PSE","2000recreational20000724","Ed Schild",0.218629,2000,"recreational",2000-07-24
"731","Van De Vanter Group","2000recreational20000724","Jamie Van De Vanter",0.240665,2000,"recreational",2000-07-24
"732","IAC","2000recreational20000724","Jim Eychaner",0.220077,2000,"recreational",2000-07-24
"733","PSE","2000recreational20000724","Joel Molander",0.199572,2000,"recreational",2000-07-24
"734","Osprey Environmental Services, Inc.","2000recreational20000724","Ken Wilcox",0.220177,2000,"recreational",2000-07-24
"735","PDSA Consulting","2000recreational20000724","Lyn Wiltse",0.222231,2000,"recreational",2000-07-24
"736",NA,"2000recreational20000724","Vernon Chris",0.586848,2000,"recreational",2000-07-24
"737","W","2000recreational20000925","A.J. Malk",0.166782,2000,"recreational",2000-09-25
"738",NA,"2000recreational20000925","R.C. Szaro",0.175905,2000,"recreational",2000-09-25
"739","R","2000recreational20000925","W.T. Sexton",0.165161,2000,"recreational",2000-09-25
"740","PSE","2000recreational20001030","Bob Barnes",0.503052,2000,"recreational",2000-10-30
"741","Miller Consulting","2000recreational20001030","Curt Miller",0.289574,2000,"recreational",2000-10-30
"742","PSE","2000recreational20001127","Andy Hatfield",0.27641,2000,"recreational",2000-11-27
"743","USFS","2000recreational20001127","Ann Dunphy",0.452542,2000,"recreational",2000-11-27
"744","PSE","2000recreational20001127","Bob Barnes",0.311624,2000,"recreational",2000-11-27
"745","Huckell/Weinman Associates","2000recreational20001127","Chris Lawson",0.437756,2000,"recreational",2000-11-27
"746","Miller Consulting","2000recreational20001127","Curt Miller",0.533978,2000,"recreational",2000-11-27
"747","IAC","2000recreational20001127","Jim Eychaner",0.429237,2000,"recreational",2000-11-27
"748","PDSA Consulting","2000recreational20001127","Lyn Wiltse",0.29725,2000,"recreational",2000-11-27
"749","Town of Concrete","2000recreational20001127","Paul Schissler",0.320317,2000,"recreational",2000-11-27
"750","North Cascades Institute","2000recreational20001127","Saul Weisberg",0.472417,2000,"recreational",2000-11-27
"751","PSE","2000recreational20001127","Tony Fuchs",0.702465,2000,"recreational",2000-11-27
"752","USACE","2000recreational20001127","Wayne Wagner",0.439671,2000,"recreational",2000-11-27
"753","PSE","2000recreational20001218","Bob Barnes",0.329858,2000,"recreational",2000-12-18
"754","Skagit River System Coop","2000recreational20001218","Stan Walsh",0.212356,2000,"recreational",2000-12-18
"755","USACE","2000recreational20001218","Wayne Wagner",0.246472,2000,"recreational",2000-12-18
"756","Wildcat Steelhead Club","2000solution20001025","Bill Reinard",0.228646,2000,"admin",2000-10-25
"757","Citizen","2000solution20001025","Bob Helton",0.228475,2000,"admin",2000-10-25
"758","PSE","2000solution20001025","Cary Feldmann",0.230397,2000,"admin",2000-10-25
"759","PSE","2000solution20001025","Connie Freeland",0.320932,2000,"admin",2000-10-25
"760","Trout Unlimited","2000solution20001025","Don Schluter",0.236777,2000,"admin",2000-10-25
"761","WDFW","2000solution20001025","Gary Sprague",0.218926,2000,"admin",2000-10-25
"762","City of Anacortes and Skagit County PUD","2000solution20001025","Jerry Louthain",0.227212,2000,"admin",2000-10-25
"763","USFS","2000solution20001025","Jon Vanderheyden",0.227387,2000,"admin",2000-10-25
"764","USFS","2000solution20001025","Kathy Anderson",0.22529,2000,"admin",2000-10-25
"765","Skagit River System Coop","2000solution20001025","Larry Wasserman",0.227885,2000,"admin",2000-10-25
"766","PSE","2000solution20001025","Lloyd Pernela",0.229135,2000,"admin",2000-10-25
"767","PDSA Consulting","2000solution20001025","Lyn Wiltse",0.259877,2000,"admin",2000-10-25
"768","USACE","2000solution20001025","Marian Valentine",0.19801,2000,"admin",2000-10-25
"769","Town of Concrete","2000solution20001025","Paul Schissler",0.242792,2000,"admin",2000-10-25
"770","Skagit River System Coop","2000solution20001025","Stan Walsh",0.226948,2000,"admin",2000-10-25
"771","USACE","2000solution20001025","Wayne Wagner",0.225522,2000,"admin",2000-10-25
"772","Wildcat Steelhead Club","2000solution20001213","Bill Reinard",0.34285,2000,"admin",2000-12-13
"773","Citizen","2000solution20001213","Bob Helton",0.343328,2000,"admin",2000-12-13
"774","PSE","2000solution20001213","Cary Feldmann",0.298759,2000,"admin",2000-12-13
"775","PSE","2000solution20001213","Connie Freeland",0.654357,2000,"admin",2000-12-13
"776","Trout Unlimited","2000solution20001213","Don Schluter",0.357574,2000,"admin",2000-12-13
"777","City of Anacortes and Skagit County PUD","2000solution20001213","Jerry Louthain",0.444534,2000,"admin",2000-12-13
"778","Concrete Heritage Museum","2000solution20001213","John Boggs",0.400384,2000,"admin",2000-12-13
"779","USFS","2000solution20001213","Jon Vanderheyden",0.3466,2000,"admin",2000-12-13
"780","PSE","2000solution20001213","Lloyd Pernela",0.389015,2000,"admin",2000-12-13
"781","PDSA Consulting","2000solution20001213","Lyn Wiltse",0.334264,2000,"admin",2000-12-13
"782","USACE","2000solution20001213","Marian Valentine",0.339848,2000,"admin",2000-12-13
"783","NCCC","2000solution20001213","Patrick Goldsworthy",0.417125,2000,"admin",2000-12-13
"784","Town of Concrete","2000solution20001213","Paul Schissler",0.372265,2000,"admin",2000-12-13
"785","WDOE","2000solution20001213","Rod Sakrison",0.414022,2000,"admin",2000-12-13
"786","Skagit River System Coop","2000solution20001213","Stan Walsh",0.353384,2000,"admin",2000-12-13
"787","NMFS","2000solution20001213","Steve Fransen",0.399259,2000,"admin",2000-12-13
"788","PSE","2000water20000608","Bob Barnes",0.380637,2000,"aquatic/fish",2000-06-08
"789","WDOE","2000water20000608","Bob Newman",0.336271,2000,"aquatic/fish",2000-06-08
"790","PSE","2000water20000608","Cary Feldmann",0.294009,2000,"aquatic/fish",2000-06-08
"791","WDFW","2000water20000608","Gary Sprague",0.379191,2000,"aquatic/fish",2000-06-08
"792","City of Anacortes and Skagit County PUD","2000water20000608","Jerry Louthain",0.324408,2000,"aquatic/fish",2000-06-08
"793","NPS","2000water20000608","Jon Riedel",0.301845,2000,"aquatic/fish",2000-06-08
"794","USFS","2000water20000608","Jon Vanderheyden",0.402866,2000,"aquatic/fish",2000-06-08
"795","PDSA Consulting","2000water20000608","Lyn Wiltse",0.292693,2000,"aquatic/fish",2000-06-08
"796","Puget Sound Anglers","2000water20000608","Polly Fischer",0.44174,2000,"aquatic/fish",2000-06-08
"797","NPS","2000water20000608","Reed Glesne",0.291065,2000,"aquatic/fish",2000-06-08
"798","WDOE","2000water20000608","Rod Sakrison",0.291365,2000,"aquatic/fish",2000-06-08
"799","Skagit River System Coop","2000water20000608","Stan Walsh",0.30336,2000,"aquatic/fish",2000-06-08
"800","USACE","2000water20000608","Wayne Wagner",0.311871,2000,"aquatic/fish",2000-06-08
"801","PSE","2000water20000713","Barb Gassler",0.301675,2000,"aquatic/fish",2000-07-13
"802","Wildcat Steelhead Club","2000water20000713","Bill Reinard",0.308709,2000,"aquatic/fish",2000-07-13
"803","PSE","2000water20000713","Bob Barnes",0.384072,2000,"aquatic/fish",2000-07-13
"804","WDOE","2000water20000713","Bob Newman",0.306133,2000,"aquatic/fish",2000-07-13
"805","PSE","2000water20000713","Ed Schild",0.296226,2000,"aquatic/fish",2000-07-13
"806","USFWS","2000water20000713","Fred Seavey",0.390328,2000,"aquatic/fish",2000-07-13
"807","WDFW","2000water20000713","Gary Sprague",0.284458,2000,"aquatic/fish",2000-07-13
"808","Fred","2000water20000713","Jackie Vanderveen",0.272731,2000,"aquatic/fish",2000-07-13
"809","USFS","2000water20000713","Jon Vanderheyden",0.325632,2000,"aquatic/fish",2000-07-13
"810","PDSA Consulting","2000water20000713","Lyn Wiltse",0.369606,2000,"aquatic/fish",2000-07-13
"811","Puget Sound Anglers","2000water20000713","Polly Fischer",0.29068,2000,"aquatic/fish",2000-07-13
"812","NPS","2000water20000713","Reed Glesne",0.284118,2000,"aquatic/fish",2000-07-13
"813","WDOE","2000water20000713","Rod Sakrison",0.284301,2000,"aquatic/fish",2000-07-13
"814","Skagit River System Coop","2000water20000713","Stan Walsh",0.296274,2000,"aquatic/fish",2000-07-13
"815","W","2000water20000914","A.J. Malk",0.231991,2000,"aquatic/fish",2000-09-14
"816","PSE","2000water20000914","Bob Barnes",0.52578,2000,"aquatic/fish",2000-09-14
"817","Environmental Agreements","2000water20000914","Bruce Freet",0.253172,2000,"aquatic/fish",2000-09-14
"818",NA,"2000water20000914","Mark Hummel",0.303671,2000,"aquatic/fish",2000-09-14
"819",NA,"2000water20000914","R.C. Szaro",0.241696,2000,"aquatic/fish",2000-09-14
"820","R","2000water20000914","W.T. Sexton",0.228433,2000,"aquatic/fish",2000-09-14
"821","Skagit County Noxious Weed Control Board","2000wildlife20000523","Bill Rogers",0.306115,2000,"terrestrial",2000-05-23
"822","USFS","2000wildlife20000523","Carl Corey",0.279737,2000,"terrestrial",2000-05-23
"823","USFS","2000wildlife20000523","Don Gay",0.301516,2000,"terrestrial",2000-05-23
"824","WDFW","2000wildlife20000523","Lauri Vigue",0.289791,2000,"terrestrial",2000-05-23
"825","PDSA Consulting","2000wildlife20000523","Lyn Wiltse",0.277296,2000,"terrestrial",2000-05-23
"826","Biota-Pacific","2000wildlife20000523","Marty Vaughn",0.370189,2000,"terrestrial",2000-05-23
"827","WDFW","2000wildlife20000523","Mike Davison",0.277329,2000,"terrestrial",2000-05-23
"828","NCCC","2000wildlife20000523","Patrick Goldsworthy",0.352971,2000,"terrestrial",2000-05-23
"829","Skagit River System Coop","2000wildlife20000523","Stan Walsh",0.473454,2000,"terrestrial",2000-05-23
"830","PSE","2000wildlife20000523","Tony Fuchs",0.813591,2000,"terrestrial",2000-05-23
"831","USFS","2000wildlife20000620","Ann Risvold",0.27433,2000,"terrestrial",2000-06-20
"832","USFS","2000wildlife20000620","Don Gay",0.373975,2000,"terrestrial",2000-06-20
"833","USFWS","2000wildlife20000620","Fred Seavey",0.276888,2000,"terrestrial",2000-06-20
"834","Whatcom County Noxious Weed Control Board","2000wildlife20000620","Laurel Baldwin",0.34769,2000,"terrestrial",2000-06-20
"835","WDFW","2000wildlife20000620","Lauri Vigue",0.299115,2000,"terrestrial",2000-06-20
"836","PDSA Consulting","2000wildlife20000620","Lyn Wiltse",0.276141,2000,"terrestrial",2000-06-20
"837","Biota-Pacific","2000wildlife20000620","Marty Vaughn",0.418423,2000,"terrestrial",2000-06-20
"838","WDNR","2000wildlife20000620","Rich Sluss",0.277368,2000,"terrestrial",2000-06-20
"839","NPS","2000wildlife20000620","Robert Kuntz",0.274401,2000,"terrestrial",2000-06-20
"840","Skagit River System Coop","2000wildlife20000620","Stan Walsh",0.273429,2000,"terrestrial",2000-06-20
"841","PSE","2000wildlife20000620","Tony Fuchs",0.791861,2000,"terrestrial",2000-06-20
"842","USFS","2000wildlife20000718","Ann Risvold",0.202101,2000,"terrestrial",2000-07-18
"843","USFS","2000wildlife20000718","Carl Corey",0.294462,2000,"terrestrial",2000-07-18
"844","PSE","2000wildlife20000718","Charles Morton",0.204663,2000,"terrestrial",2000-07-18
"845","USFS","2000wildlife20000718","Don Gay",0.235408,2000,"terrestrial",2000-07-18
"846","PSE","2000wildlife20000718","Ed Schild",0.230322,2000,"terrestrial",2000-07-18
"847","USFWS","2000wildlife20000718","Fred Seavey",0.275025,2000,"terrestrial",2000-07-18
"848","WDFW","2000wildlife20000718","Lauri Vigue",0.336312,2000,"terrestrial",2000-07-18
"849","PDSA Consulting","2000wildlife20000718","Lyn Wiltse",0.22333,2000,"terrestrial",2000-07-18
"850","WDNR","2000wildlife20000718","Rich Sluss",0.196525,2000,"terrestrial",2000-07-18
"851","NPS","2000wildlife20000718","Robert Kuntz",0.221871,2000,"terrestrial",2000-07-18
"852","Skagit River System Coop","2000wildlife20000718","Stan Walsh",0.221231,2000,"terrestrial",2000-07-18
"853","PSE","2000wildlife20000718","Tony Fuchs",0.563983,2000,"terrestrial",2000-07-18
"854","W","2000wildlife20000919","A.J. Malk",0.223013,2000,"terrestrial",2000-09-19
"855","PSE","2000wildlife20000919","Bob Barnes",0.385882,2000,"terrestrial",2000-09-19
"856",NA,"2000wildlife20000919","R.C. Szaro",0.234261,2000,"terrestrial",2000-09-19
"857","R","2000wildlife20000919","W.T. Sexton",0.220782,2000,"terrestrial",2000-09-19
"858","Skagit County Noxious Weed Control Board","2000wildlife20001017","Bill Rogers",0.326326,2000,"terrestrial",2000-10-17
"859","PSE","2000wildlife20001017","Bob Barnes",0.260433,2000,"terrestrial",2000-10-17
"860","NPS","2000wildlife20001017","Bob Kuntz",0.309801,2000,"terrestrial",2000-10-17
"861","Environmental Agreements","2000wildlife20001017","Bruce Freet",0.275165,2000,"terrestrial",2000-10-17
"862","USFS","2000wildlife20001017","Carl Corey",0.301468,2000,"terrestrial",2000-10-17
"863","PSE","2000wildlife20001017","Ed Schild",0.314894,2000,"terrestrial",2000-10-17
"864","USFWS","2000wildlife20001017","Fred Seavey",0.305473,2000,"terrestrial",2000-10-17
"865","WDFW","2000wildlife20001017","Lauri Vigue",0.306471,2000,"terrestrial",2000-10-17
"866","PDSA Consulting","2000wildlife20001017","Lyn Wiltse",0.323123,2000,"terrestrial",2000-10-17
"867","Biota-Pacific","2000wildlife20001017","Marty Vaughn",0.3863,2000,"terrestrial",2000-10-17
"868","NCCC","2000wildlife20001017","Patrick Goldsworthy",0.303947,2000,"terrestrial",2000-10-17
"869","NPS","2000wildlife20001017","Regina Rochefort",0.304321,2000,"terrestrial",2000-10-17
"870","Skagit River System Coop","2000wildlife20001017","Stan Walsh",0.301698,2000,"terrestrial",2000-10-17
"871","PSE","2000wildlife20001017","Tony Fuchs",0.632139,2000,"terrestrial",2000-10-17
"872","PSE","2000wildlife20001205","Bob Barnes",0.364514,2000,"terrestrial",2000-12-05
"873","RMEF","2000wildlife20001205","Bob Nelson",0.445746,2000,"terrestrial",2000-12-05
"874","USFS","2000wildlife20001205","Carl Corey",0.666904,2000,"terrestrial",2000-12-05
"875","USFWS","2000wildlife20001205","Fred Seavey",0.412912,2000,"terrestrial",2000-12-05
"876","WDFW","2000wildlife20001205","Lauri Vigue",0.604346,2000,"terrestrial",2000-12-05
"877","USACE","2000wildlife20001205","Wayne Wagner",0.333394,2000,"terrestrial",2000-12-05
"878","PSE","2001aquatic20010111","Arnie Aspelund",0.77011,2001,"aquatic/fish",2001-01-11
"879","SFEG","2001aquatic20010111","Arn Thoreen",0.289463,2001,"aquatic/fish",2001-01-11
"880","PSE","2001aquatic20010111","Bob Barnes",0.366691,2001,"aquatic/fish",2001-01-11
"881","USFS","2001aquatic20010111","Brady Green",0.344918,2001,"aquatic/fish",2001-01-11
"882","PSE","2001aquatic20010111","Cary Feldmann",0.287885,2001,"aquatic/fish",2001-01-11
"883","USACE","2001aquatic20010111","Chuck Ebel",0.286237,2001,"aquatic/fish",2001-01-11
"884","Fidalgo Fly Fishers","2001aquatic20010111","Dick Raisler",0.286174,2001,"aquatic/fish",2001-01-11
"885","Trout Unlimited","2001aquatic20010111","Don Schluter",0.287648,2001,"aquatic/fish",2001-01-11
"886","PSE","2001aquatic20010111","Doug Bruland",0.284727,2001,"aquatic/fish",2001-01-11
"887","USFS","2001aquatic20010111","Jon Vanderheyden",0.388685,2001,"aquatic/fish",2001-01-11
"888","WDFW","2001aquatic20010111","Karen Kloempken",0.348357,2001,"aquatic/fish",2001-01-11
"889","PDSA Consulting","2001aquatic20010111","Lyn Wiltse",0.561904,2001,"aquatic/fish",2001-01-11
"890","PSE","2001aquatic20010111","Nick Verretto",0.736386,2001,"aquatic/fish",2001-01-11
"891","WDOE","2001aquatic20010111","Rod Sakrison",0.284815,2001,"aquatic/fish",2001-01-11
"892","Skagit River System Coop","2001aquatic20010111","Stan Walsh",0.547171,2001,"aquatic/fish",2001-01-11
"893","WDNR","2001aquatic20010111","Steve Jennison",0.286226,2001,"aquatic/fish",2001-01-11
"894","USFS","2001aquatic20010208","Brady Green",0.170775,2001,"aquatic/fish",2001-02-08
"895","PDSA Consulting","2001aquatic20010208","Lyn Wiltse",0.327088,2001,"aquatic/fish",2001-02-08
"896","R2 Resource Consultants","2001aquatic20010208","Sue Madsen",0.371424,2001,"aquatic/fish",2001-02-08
"897","SFEG","2001aquatic20010308","Arn Thoreen",0.394546,2001,"aquatic/fish",2001-03-08
"898","USFS","2001aquatic20010308","Brady Green",0.58497,2001,"aquatic/fish",2001-03-08
"899","PDSA Consulting","2001aquatic20010308","Lyn Wiltse",0.768876,2001,"aquatic/fish",2001-03-08
"900","PSE","2001aquatic20010412","Arnie Aspelund",0.391191,2001,"aquatic/fish",2001-04-12
"901","SFEG","2001aquatic20010412","Arn Thoreen",0.384408,2001,"aquatic/fish",2001-04-12
"902","Wildcat Steelhead Club","2001aquatic20010412","Bill Reinard",0.375483,2001,"aquatic/fish",2001-04-12
"903","PSE","2001aquatic20010412","Bob Barnes",0.285626,2001,"aquatic/fish",2001-04-12
"904","WDOE","2001aquatic20010412","Bob Wright",0.483017,2001,"aquatic/fish",2001-04-12
"905","USFS","2001aquatic20010412","Brady Green",0.61528,2001,"aquatic/fish",2001-04-12
"906","PSE","2001aquatic20010412","Cary Feldmann",0.282429,2001,"aquatic/fish",2001-04-12
"907","Fidalgo Fly Fishers","2001aquatic20010412","Dick Raisler",0.28132,2001,"aquatic/fish",2001-04-12
"908","City of Anacortes and Skagit County PUD","2001aquatic20010412","Jerry Louthain",0.280569,2001,"aquatic/fish",2001-04-12
"909","WDFW","2001aquatic20010412","Karen Kloempken",0.281467,2001,"aquatic/fish",2001-04-12
"910","PDSA Consulting","2001aquatic20010412","Lyn Wiltse",0.677203,2001,"aquatic/fish",2001-04-12
"911","R2 Resource Consultants","2001aquatic20010412","Phil Hilgert",0.47499,2001,"aquatic/fish",2001-04-12
"912","WDOE","2001aquatic20010412","Rod Sakrison",0.283565,2001,"aquatic/fish",2001-04-12
"913","Skagit River System Coop","2001aquatic20010412","Stan Walsh",0.37408,2001,"aquatic/fish",2001-04-12
"914","NMFS","2001aquatic20010412","Steve Fransen",0.345309,2001,"aquatic/fish",2001-04-12
"915","R2 Resource Consultants","2001aquatic20010412","Sue Madsen",0.577664,2001,"aquatic/fish",2001-04-12
"916","PSE","2001aquatic20010510","Arnie Aspelund",0.484576,2001,"aquatic/fish",2001-05-10
"917","SFEG","2001aquatic20010510","Arn Thoreen",0.34134,2001,"aquatic/fish",2001-05-10
"918","WDOE","2001aquatic20010510","Bob Wright",0.297148,2001,"aquatic/fish",2001-05-10
"919","USFS","2001aquatic20010510","Brady Green",0.350862,2001,"aquatic/fish",2001-05-10
"920","USFS","2001aquatic20010510","Carl Corey",0.467467,2001,"aquatic/fish",2001-05-10
"921","PSE","2001aquatic20010510","Cary Feldmann",0.270357,2001,"aquatic/fish",2001-05-10
"922","USACE","2001aquatic20010510","Chuck Ebel",0.271237,2001,"aquatic/fish",2001-05-10
"923","Fidalgo Fly Fishers","2001aquatic20010510","Dick Raisler",0.269812,2001,"aquatic/fish",2001-05-10
"924","Trout Unlimited","2001aquatic20010510","Don Schluter",0.269449,2001,"aquatic/fish",2001-05-10
"925","PSE","2001aquatic20010510","Doug Bruland",0.269254,2001,"aquatic/fish",2001-05-10
"926","USFWS","2001aquatic20010510","Fred Seavey",0.271646,2001,"aquatic/fish",2001-05-10
"927","WDFW","2001aquatic20010510","Gary Sprague",0.434337,2001,"aquatic/fish",2001-05-10
"928","USFS","2001aquatic20010510","Jim Chu",0.311652,2001,"aquatic/fish",2001-05-10
"929","WDFW","2001aquatic20010510","Karen Kloempken",0.269788,2001,"aquatic/fish",2001-05-10
"930","PSE","2001aquatic20010510","Kristen Schuldt",0.275299,2001,"aquatic/fish",2001-05-10
"931","PDSA Consulting","2001aquatic20010510","Lyn Wiltse",0.645892,2001,"aquatic/fish",2001-05-10
"932","PSE","2001aquatic20010510","Nick Verretto",0.358894,2001,"aquatic/fish",2001-05-10
"933",NA,"2001aquatic20010510","Paul Uncapher",0.296996,2001,"aquatic/fish",2001-05-10
"934","R2 Resource Consultants","2001aquatic20010510","Phil Hilgert",0.566577,2001,"aquatic/fish",2001-05-10
"935","WDOE","2001aquatic20010510","Rod Sakrison",0.370509,2001,"aquatic/fish",2001-05-10
"936","Skagit River System Coop","2001aquatic20010510","Stan Walsh",0.281105,2001,"aquatic/fish",2001-05-10
"937","R2 Resource Consultants","2001aquatic20010510","Sue Madsen",0.350594,2001,"aquatic/fish",2001-05-10
"938","PSE","2001aquatic20010614","Bob Barnes",0.462221,2001,"aquatic/fish",2001-06-14
"939","USFS","2001aquatic20010614","Brady Green",0.657445,2001,"aquatic/fish",2001-06-14
"940","USACE","2001aquatic20010614","Chuck Ebel",0.717089,2001,"aquatic/fish",2001-06-14
"941","USFS","2001aquatic20010614","Jim Chu",0.465156,2001,"aquatic/fish",2001-06-14
"942","PDSA Consulting","2001aquatic20010614","Lyn Wiltse",0.934591,2001,"aquatic/fish",2001-06-14
"943","Wildcat Steelhead Club","2001aquatic20010712","Bill Reinard",0.275573,2001,"aquatic/fish",2001-07-12
"944","John","2001aquatic20010712","Bob Hayman",0.250684,2001,"aquatic/fish",2001-07-12
"945","USFS","2001aquatic20010712","Brady Green",0.537157,2001,"aquatic/fish",2001-07-12
"946","Trout Unlimited","2001aquatic20010712","Don Schluter",0.357004,2001,"aquatic/fish",2001-07-12
"947","PSE","2001aquatic20010712","Doug Bruland",0.275228,2001,"aquatic/fish",2001-07-12
"948","USFWS","2001aquatic20010712","Fred Seavey",0.361534,2001,"aquatic/fish",2001-07-12
"949","USFS","2001aquatic20010712","Jim Chu",0.589752,2001,"aquatic/fish",2001-07-12
"950","WDFW","2001aquatic20010712","Karen Kloempken",0.343682,2001,"aquatic/fish",2001-07-12
"951","PDSA Consulting","2001aquatic20010712","Lyn Wiltse",0.619121,2001,"aquatic/fish",2001-07-12
"952","PSE","2001aquatic20010712","Nick Verretto",0.70917,2001,"aquatic/fish",2001-07-12
"953","R2 Resource Consultants","2001aquatic20010712","Phil Hilgert",0.797491,2001,"aquatic/fish",2001-07-12
"954","PSE","2001aquatic20010809","Arnie Aspelund",0.453751,2001,"aquatic/fish",2001-08-09
"955","Wildcat Steelhead Club","2001aquatic20010809","Bill Reinard",0.242297,2001,"aquatic/fish",2001-08-09
"956","John","2001aquatic20010809","Bob Hayman",0.321687,2001,"aquatic/fish",2001-08-09
"957","Environmental Agreements","2001aquatic20010809","Bruce Freet",0.272693,2001,"aquatic/fish",2001-08-09
"958","USACE","2001aquatic20010809","Chuck Ebel",0.444991,2001,"aquatic/fish",2001-08-09
"959","Fidalgo Fly Fishers","2001aquatic20010809","Dick Raisler",0.307722,2001,"aquatic/fish",2001-08-09
"960","Trout Unlimited","2001aquatic20010809","Don Schluter",0.307578,2001,"aquatic/fish",2001-08-09
"961","PSE","2001aquatic20010809","Doug Bruland",0.314024,2001,"aquatic/fish",2001-08-09
"962","USFWS","2001aquatic20010809","Fred Seavey",0.384564,2001,"aquatic/fish",2001-08-09
"963","WDFW","2001aquatic20010809","Gary Sprague",0.304154,2001,"aquatic/fish",2001-08-09
"964","USFS","2001aquatic20010809","Jim Chu",0.50352,2001,"aquatic/fish",2001-08-09
"965",NA,"2001aquatic20010809","John Nessler",0.245338,2001,"aquatic/fish",2001-08-09
"966","USFS","2001aquatic20010809","Jon Vanderheyden",0.320231,2001,"aquatic/fish",2001-08-09
"967","PDSA Consulting","2001aquatic20010809","Lyn Wiltse",0.837519,2001,"aquatic/fish",2001-08-09
"968","Sue","2001aquatic20010809","Marcus Appy",0.368218,2001,"aquatic/fish",2001-08-09
"969","PSE","2001aquatic20010809","Nick Verretto",0.657082,2001,"aquatic/fish",2001-08-09
"970","R2 Resource Consultants","2001aquatic20010809","Phil Hilgert",0.552363,2001,"aquatic/fish",2001-08-09
"971","Skagit River System Coop","2001aquatic20010809","Stan Walsh",0.306354,2001,"aquatic/fish",2001-08-09
"972","R2 Resource Consultants","2001aquatic20010809","Sue Madsen",0.851103,2001,"aquatic/fish",2001-08-09
"973","PSE","2001aquatic20010913","Bob Barnes",0.187195,2001,"aquatic/fish",2001-09-13
"974","RMEF","2001aquatic20010913","Bob Nelson",0.198601,2001,"aquatic/fish",2001-09-13
"975","WDOE","2001aquatic20010913","Bob Wright",0.293125,2001,"aquatic/fish",2001-09-13
"976","Trout Unlimited","2001aquatic20010913","Don Schluter",0.356896,2001,"aquatic/fish",2001-09-13
"977","USFWS","2001aquatic20010913","Fred Seavey",0.243274,2001,"aquatic/fish",2001-09-13
"978","USFS","2001aquatic20010913","Jim Chu",0.242219,2001,"aquatic/fish",2001-09-13
"979","PDSA Consulting","2001aquatic20010913","Lyn Wiltse",0.536914,2001,"aquatic/fish",2001-09-13
"980","WA","2001aquatic20010913","Ron McBride",0.208854,2001,"aquatic/fish",2001-09-13
"981","Skagit River System Coop","2001aquatic20010913","Stan Walsh",0.393536,2001,"aquatic/fish",2001-09-13
"982","PSE","2001aquatic20011023","Bob Barnes",0.244702,2001,"aquatic/fish",2001-10-23
"983","John","2001aquatic20011023","Bob Hayman",0.263409,2001,"aquatic/fish",2001-10-23
"984","USFS","2001aquatic20011023","Brady Green",0.386997,2001,"aquatic/fish",2001-10-23
"985",NA,"2001aquatic20011023","Ed Connor",0.313527,2001,"aquatic/fish",2001-10-23
"986","USFWS","2001aquatic20011023","Fred Seavey",0.469084,2001,"aquatic/fish",2001-10-23
"987","PDSA Consulting","2001aquatic20011023","Lyn Wiltse",0.567918,2001,"aquatic/fish",2001-10-23
"988","R2 Resource Consultants","2001aquatic20011023","Phil Hilgert",0.559689,2001,"aquatic/fish",2001-10-23
"989","PSE","2001aquatic20011120","Arnie Aspelund",0.432481,2001,"aquatic/fish",2001-11-20
"990","SFEG","2001aquatic20011120","Arn Thoreen",0.312115,2001,"aquatic/fish",2001-11-20
"991","PSE","2001aquatic20011120","Bob Barnes",0.363295,2001,"aquatic/fish",2001-11-20
"992","PSE","2001aquatic20011120","Cary Feldmann",0.246202,2001,"aquatic/fish",2001-11-20
"993",NA,"2001aquatic20011120","David Beauchamp",0.22744,2001,"aquatic/fish",2001-11-20
"994","Trout Unlimited","2001aquatic20011120","Don Schluter",0.303419,2001,"aquatic/fish",2001-11-20
"995","PSE","2001aquatic20011120","Doug Bruland",0.301218,2001,"aquatic/fish",2001-11-20
"996","USFWS","2001aquatic20011120","Fred Seavey",0.297103,2001,"aquatic/fish",2001-11-20
"997","WDFW","2001aquatic20011120","Gary Sprague",0.416313,2001,"aquatic/fish",2001-11-20
"998","USFS","2001aquatic20011120","Greta Movassaghi",0.21254,2001,"aquatic/fish",2001-11-20
"999","USFS","2001aquatic20011120","Jon Vanderheyden",0.28482,2001,"aquatic/fish",2001-11-20
"1000","PDSA Consulting","2001aquatic20011120","Lyn Wiltse",0.675991,2001,"aquatic/fish",2001-11-20
"1001","MWH","2001aquatic20011120","MaryLouise Keefe",0.242403,2001,"aquatic/fish",2001-11-20
"1002","R2 Resource Consultants","2001aquatic20011120","Phil Hilgert",0.423194,2001,"aquatic/fish",2001-11-20
"1003","WDOE","2001aquatic20011120","Rod Sakrison",0.244494,2001,"aquatic/fish",2001-11-20
"1004",NA,"2001aquatic20011120","Sam Wright",0.234886,2001,"aquatic/fish",2001-11-20
"1005","Skagit River System Coop","2001aquatic20011120","Stan Walsh",0.285553,2001,"aquatic/fish",2001-11-20
"1006","NMFS","2001aquatic20011120","Steve Fransen",0.278633,2001,"aquatic/fish",2001-11-20
"1007","R2 Resource Consultants","2001aquatic20011120","Sue Madsen",0.352462,2001,"aquatic/fish",2001-11-20
"1008","HRA","2001cultural20010109","Alex Maass",0.313306,2001,"cultural",2001-01-09
"1009","PSE","2001cultural20010109","Bob Barnes",0.390092,2001,"cultural",2001-01-09
"1010","NPS","2001cultural20010109","Bob Mierendorf",0.294307,2001,"cultural",2001-01-09
"1011","Huckell/Weinman Associates","2001cultural20010109","Chris Lawson",0.303248,2001,"cultural",2001-01-09
"1012","PSE","2001cultural20010109","Connie Freeland",0.403988,2001,"cultural",2001-01-09
"1013","Sauk-Suiattle Indian Tribe","2001cultural20010109","Ernie DeCoteau",0.327239,2001,"cultural",2001-01-09
"1014","Concrete Heritage Museum","2001cultural20010109","Gail Boggs",0.404631,2001,"cultural",2001-01-09
"1015","Historical Research Associates","2001cultural20010109","Gail Thompson",0.358473,2001,"cultural",2001-01-09
"1016","USFS","2001cultural20010109","Jan Hollenbeck",0.328906,2001,"cultural",2001-01-09
"1017","PSE","2001cultural20010109","Jason Schmidt",0.345658,2001,"cultural",2001-01-09
"1018","PSE","2001cultural20010109","Jessie Piper",0.491255,2001,"cultural",2001-01-09
"1019","Concrete Heritage Museum","2001cultural20010109","John Boggs",0.372157,2001,"cultural",2001-01-09
"1020","USFS","2001cultural20010109","Kathy Anderson",0.391537,2001,"cultural",2001-01-09
"1021","WDNR","2001cultural20010109","Lee Stilson",0.312697,2001,"cultural",2001-01-09
"1022","PDSA Consulting","2001cultural20010109","Lyn Wiltse",0.335837,2001,"cultural",2001-01-09
"1023","WAHP","2001cultural20010109","Rob Whitlam",0.483507,2001,"cultural",2001-01-09
"1024","Sauk-Suiattle Indian Tribe","2001cultural20010109","Shari Brewer",0.320799,2001,"cultural",2001-01-09
"1025","PSE","2001cultural20010212","Bob Barnes",0.257852,2001,"cultural",2001-02-12
"1026","Sauk-Suiattle Indian Tribe","2001cultural20010212","Lawrence Joseph",0.48232,2001,"cultural",2001-02-12
"1027","PSE","2001cultural20010313","Bob Barnes",0.555601,2001,"cultural",2001-03-13
"1028","NPS","2001cultural20010410","Bob Mierendorf",0.780823,2001,"cultural",2001-04-10
"1029","PSE","2001cultural20010410","Connie Freeland",0.29974,2001,"cultural",2001-04-10
"1030","PSE","2001cultural20010410","Ed Schild",0.338299,2001,"cultural",2001-04-10
